author,content,description,publishedAt,source,title,url,urlToImage
BINYAMIN APPELBAUM,"For the first time in recent years, the Fed did not describe monetary policy as accommodative, indicating that its benchmark interest rate is rising back to a level that the Fed regards as neutral, meaning monetary policy is neither stimulating nor restrainin… [+1257 chars]","The Federal Reserve chairman, Jerome H. Powell, will have a chance to calibrate investors’ expectations when he speaks at a news conference Wednesday afternoon.",2018-09-26T18:02:06Z,"{'id': 'the-new-york-times', 'name': 'The New York Times'}",Fed Raises Rates for Third Time in 2018,https://www.nytimes.com/2018/09/26/us/politics/federal-reserve-raises-interest-rates.html,https://static01.nyt.com/images/2018/09/27/business/27dc-fed/27dc-fed-facebookJumbo.jpg
"Emily Lipstein on Earther, shared by Andrew Couts to Gizmodo","Last year, Gizmodo launched Earther, a new website dedicated to the environment, the people and entities working to save or destroy it, and those who will be most impacted by its destruction. Weve survived a lot in the past 12 months, from Scott Pruitts EPA t… [+9575 chars]","Last year, Gizmodo launched Earther, a new website dedicated to the environment, the people and entities working to save or destroy it, and those who will be most impacted by its destruction. We’ve survived a lot in the past 12 months, from Scott Pruitt’s EPA…",2018-09-27T15:15:00Z,"{'id': None, 'name': 'Gizmodo.com'}",A Year on Planet Earther,https://earther.gizmodo.com/a-year-on-planet-earther-1829349647,"https://i.kinja-img.com/gawker-media/image/upload/s--cDZMbVxg--/c_fill,fl_progressive,g_center,h_900,q_80,w_1600/jtvugn09clhuq7rhbglg.jpg"
Jeff Grubb,"Capcom has killed Capcom Vancouver. The studio director confirmed that the publisher closed the studio today in a post on Twitter. Capcom Vancouver was best known for overseeing the Dead Rising series. “Unfortunately, Capcom Vancouver shuttered today,” studio… [+2430 chars]","Capcom has killed Capcom Vancouver. The studio director confirmed that the publisher closed the studio today in a post on Twitter. Capcom Vancouver was best known for overseeing the Dead Rising series. “Unfortunately, Capcom Vancouver shuttered today,” studio…",2018-09-18T18:26:05Z,"{'id': None, 'name': 'Venturebeat.com'}",Capcom shuts down Vancouver studio responsible for Dead Rising,https://venturebeat.com/2018/09/18/capcom-dead-rising-studio/,https://venturebeat.com/wp-content/uploads/2016/12/Dead-Rising-4_Frank-selfie.jpg?fit=1920%2C1080&strip=all
Kate Clark,"Eventbrite has taken its final step toward becoming a publicly traded company. In an updated filing this morning, the ticketing and events company announced plans to sell 10 million Class A shares on the New York Stock Exchange at a price range of $19 to $21 … [+1050 chars]","Eventbrite has taken its final step toward becoming a publicly traded company. In an updated filing this morning, the ticketing and events company announced plans to sell 10 million Class A shares on the New York Stock Exchange at a price range of $19 to $21 …",2018-09-07T15:47:26Z,"{'id': 'techcrunch', 'name': 'TechCrunch'}","Eventbrite sets IPO range of $19 to $21, valuing it at $1.8B",http://techcrunch.com/2018/09/07/eventbrite-sets-ipo-range-of-19-to-21-valuing-it-at-1-8b/,https://techcrunch.com/wp-content/uploads/2014/10/eventbriteriver.jpg?w=533
Anna Jean Kaiser in Rio de Janeiro,"The last time Renata Souza saw her friend and colleague Marielle Franco, they hugged and kissed and said theyd see each other the following morning. They were scheduled to meet with higher-ups from their political party to finalize Franco as a vice-gubernator… [+4966 chars]","Marielle Franco set an example in a country where black women make up 28% of population but hold 2% of congressional seats The last time Renata Souza saw her friend and colleague Marielle Franco, they hugged and kissed and said they’d see each other the follo…",2018-09-30T09:00:50Z,"{'id': 'the-guardian-au', 'name': 'The Guardian (AU)'}",Brazil sees black female candidates surge after murder of rising star,https://www.theguardian.com/world/2018/sep/30/brazil-sees-black-female-candidates-surge-after-of-rising-star,https://i.guim.co.uk/img/media/380afbd4589f3a54df76a330b698ec98aeb99084/0_197_6628_3979/master/6628.jpg?width=1200&height=630&quality=85&auto=format&fit=crop&crop=faces%2Centropy&bm=normal&ba=bottom%2Cleft&blend64=aHR0cHM6Ly9hc3NldHMuZ3VpbS5jby51ay9pbWFnZXMvb3ZlcmxheXMvZDM1ODZhNWVmNTc4MTc1NmQyMWEzYjYzNWU1MTcxNDEvdGctZGVmYXVsdC5wbmc&s=e65172c2bb6d4cd81c07ae3d6efbfc8a
https://www.facebook.com/bbcnews,"Image copyright AFP Image caption Argentines are angry that the government turned to the IMF (FMI in Spanish) Argentina is once again looking into the barrel of an economic crisis. The currency is sliding, inflation rising and there could well be a recession … [+3380 chars]",Fears grow that the economic crisis in Argentina could spread - but what's behind the problems?,2018-09-08T23:23:50Z,"{'id': 'bbc-news', 'name': 'BBC News'}",Argentina - the crisis in six charts,https://www.bbc.co.uk/news/business-45451208,https://ichef.bbci.co.uk/news/1024/branded_news/7FCA/production/_103341723_3786617b-e600-439a-a2f4-70cbf4f15a78.jpg
"Khushbu Shahin Wilmington, North Carolina","Two people, after waiting more than three hours in 90-degree weather for freshly made ice, had just fainted, a group of people said, pointing to an ambulance pulled up by the side of the gas station. More than a hundred onlookers standing next to coolers in s… [+5513 chars]","Hurricane Florence has depleted the town of Wilmington, emotionally exhausting its residents and responders Two people, after waiting more than three hours in 90-degree weather for freshly made ice, had just fainted, a group of people said, pointing to an amb…",2018-09-18T10:00:23Z,"{'id': 'the-guardian-au', 'name': 'The Guardian (AU)'}",Frustrating recovery: town struggles to survive amid power outages and rising temperatures,https://www.theguardian.com/world/2018/sep/18/hurricane-florence-north-carolina-recovery,https://i.guim.co.uk/img/media/a5ee1d0ef338db5284cd1f2554c8ee0f488f281b/0_501_4032_2419/master/4032.jpg?width=1200&height=630&quality=85&auto=format&usm=12&fit=crop&crop=faces%2Centropy&bm=normal&ba=bottom%2Cleft&blend64=aHR0cHM6Ly9hc3NldHMuZ3VpbS5jby51ay9pbWFnZXMvb3ZlcmxheXMvZDM1ODZhNWVmNTc4MTc1NmQyMWEzYjYzNWU1MTcxNDEvdGctZGVmYXVsdC5wbmc&s=1e2456b9439cd0c64fb180f4671da7f5
"Mike Bradley, Hannah Verdier, David Stubbs, Jonathan Wright and Paul Howlett","Black Earth Rising 9pm, BBC Two Hugo Blicks classy legal thriller reaches new heights in an instalment so full of plot twists and new developments it leaves you feeling as if you have watched a feature film. Part detective story, part courtroom drama, the sho… [+2841 chars]","Hugo Blick’s classy legal thriller reaches new heights in a twist-heavy episode 9pm, BBC Two Hugo Blick’s classy legal thriller reaches new heights in an instalment so full of plot twists and new developments it leaves you feeling as if you have watched a fea…",2018-09-24T05:00:13Z,"{'id': 'the-guardian-au', 'name': 'The Guardian (AU)'}",Monday’s best TV: Black Earth Rising; Sam & Shauna’s Big Cook Out,https://www.theguardian.com/tv-and-radio/2018/sep/24/mondays-best-tv-black-earth-rising-sam-shaunas-big-cook-out,https://i.guim.co.uk/img/media/55f32faffa24011b0ed02c7f4c993594b8c43644/0_292_3882_2328/master/3882.jpg?width=1200&height=630&quality=85&auto=format&usm=12&fit=crop&crop=faces%2Centropy&bm=normal&ba=bottom%2Cleft&blend64=aHR0cHM6Ly9hc3NldHMuZ3VpbS5jby51ay9pbWFnZXMvb3ZlcmxheXMvZDM1ODZhNWVmNTc4MTc1NmQyMWEzYjYzNWU1MTcxNDEvdGctZGVmYXVsdC5wbmc&s=a828605bba3de1ff5909faf173efebb0
"feedback@businessinsider.com (Mark Fleming), Mark Fleming","Last month, we noted in our latest Real House Price Index (RHPI) report that house price appreciation may be slowing. According to our RHPI, 21 cities experienced a monthly decline in their real, consumer house-buying power-adjusted price level. One reason fo… [+2847 chars]",David McNew/Getty Images Inventory is ticking up for higher-priced homes. Nearly half of the 50 largest cities in the US experienced an increase in the number of houses on the market in July compared with a year ago. That may signal the beginning of the end o…,2018-09-18T22:46:00Z,"{'id': None, 'name': 'Firstam.com'}",Housing inventory is rising and it may signal the start of a buyer's market,http://blog.firstam.com/economics/does-rising-housing-inventory-signal-the-beginning-of-a-buyers-market,https://amp.businessinsider.com/images/5ba14a6a0ce5f519008b6400-2732-1366.jpg
Gina Martinez,A series of photos of a rising North Carolina river over three days shows the historic scale of the flooding in parts of North Carolina – even as the storm formerly known as Hurricane Florence moves slowly out of the Carolinas. The Cape Fear River in Fayettev… [+2389 chars],A series of photos of a rising North Carolina river over three days shows the historic scale of the flooding in parts of North Carolina – even as the storm formerly known as Hurricane Florence moves slowly out of the Carolinas. The Cape Fear River in Fayettev…,2018-09-18T18:15:22Z,"{'id': 'time', 'name': 'Time'}",This Series of Photos Shows the Dramatic Flooding After Hurricane Florence – and the Water Is Still Rising,http://time.com/5399441/north-carolina-cape-fear-river-flooding/,https://timedotcom.files.wordpress.com/2018/09/fayetteville.jpg?quality=85
Mark Kaufman,"An hour’s drive from Las Vegas stands America’s Hoover Dam, a commanding barrier of concrete holding back the trillions of gallons of Colorado River water held inside Lake Mead. The dam is a proud place, built by thousands of hands and with 5 million barrels … [+5322 chars]","An hour’s drive from Las Vegas stands America’s Hoover Dam, a commanding barrier of concrete holding back the trillions of gallons of Colorado River water held inside Lake Mead. The dam is a proud place, built by thousands of hands and with 5 million barrels …",2018-09-07T17:12:42Z,"{'id': 'mashable', 'name': 'Mashable'}","The Colorado River is evaporating, and climate change is largely to blame",https://mashable.com/article/colorado-river-drought-global-warming/,https://i.amz.mshcdn.com/LEVZ30Y3GUoLcNK9bLhQtaemDcA=/1200x630/2018%2F09%2F07%2F5c%2F0229c2cb0ba64b36ae2ee5fec340daee.b3f2d.jpg
msmash,"When doctors began asking patients to explain their injuries, many were surprised to learn that the surge of broken body parts stemmed from the latest urban transportation trend: shared electric scooters. In Santa Monica, Calif. -- where one of the biggest el… [+1011 chars]","They have been pouring into emergency rooms around the nation all summer, their bodies bearing a blend of injuries that doctors normally associate with victims of car wrecks -- broken noses, wrists and shoulders, facial lacerations and fractures, as well as t…",2018-09-07T17:20:00Z,"{'id': None, 'name': 'Slashdot.org'}",Scooter Use is Rising in Major Cities. So Are Trips To the Emergency Room.,https://news.slashdot.org/story/18/09/07/1211204/scooter-use-is-rising-in-major-cities-so-are-trips-to-the-emergency-room,https://a.fsdn.com/sd/topics/transportation_64.png
Chloe Bryan,"As the world crumbles around us, take solace in this: After a years-long feud, Drake and Meek Mill have buried the hatchet. The two appeared together onstage Saturday night during the Boston stop of Drake's 'Aubrey and the Three Amigos' tour with Migos. After… [+586 chars]","As the world crumbles around us, take solace in this: After a years-long feud, Drake and Meek Mill have buried the hatchet. The two appeared together onstage Saturday night during the Boston stop of Drake's 'Aubrey and the Three Amigos' tour with Migos. After…",2018-09-09T17:28:22Z,"{'id': 'mashable', 'name': 'Mashable'}",The Drake/Meek Mill beef appears to have ended,https://mashable.com/article/drake-meek-mill-perform-together/,https://i.amz.mshcdn.com/hfM4Wrdl_HiicwFMKnTMYXOh8ok=/1200x630/2018%2F09%2F09%2F54%2F076084ff7fd04b188765e98c1f120435.bc865.jpg
Rebecca Nicholson,"Black Earth Rising is not the kind of drama that allows its audience to be caught napping. In the first couple of minutes alone, a Q&amp;A session with an esteemed human rights lawyer dissolves into a ferocious argument over the “neo-colonialist bullshit” and… [+3702 chars]","Hugo Blick combines adoption, mental health, the Rwandan genocide and the international criminal court, as Coel shows she can handle serious drama Want to comment on Black Earth Rising? Our recap has an open comment thread Black Earth Rising is not the kind o…",2018-09-10T21:00:04Z,"{'id': 'the-guardian-au', 'name': 'The Guardian (AU)'}","Black Earth Rising review – Michaela Coel shines in this rich, demanding drama",https://www.theguardian.com/tv-and-radio/2018/sep/10/black-earth-rising-review-michaela-coel-shines-in-this-rich-demanding-drama,https://i.guim.co.uk/img/media/97162a9d67e093e4e26255233d376a716830eeea/0_177_4096_2459/master/4096.jpg?width=1200&height=630&quality=85&auto=format&usm=12&fit=crop&crop=faces%2Centropy&bm=normal&ba=bottom%2Cleft&blend64=aHR0cHM6Ly9hc3NldHMuZ3VpbS5jby51ay9pbWFnZXMvb3ZlcmxheXMvZjQ0YjAzZTk3NzU5YWY0ZTk0ZmJiNDk1YTdkNmE2NmIvdGctcmV2aWV3LTQucG5n&s=3d46f1447cd993bc7b1844d3c99ae06e
https://www.facebook.com/bbcnews,"A large explosion has struck the centre of the Somali capital, Mogadishu, eyewitnesses say. Local media say the blast, suspected to be from a car bomb, took place in Howlwadag district. A school in the area has collapsed, with children feared to be among the … [+659 chars]",The suspected car bomb reportedly caused a loud blast and sent up clouds of smoke.,2018-09-02T08:01:19Z,"{'id': 'bbc-news', 'name': 'BBC News'}",'Explosion hits' Somali capital Mogadishu,https://www.bbc.co.uk/news/world-africa-45387620,https://ichef.bbci.co.uk/news/1024/branded_news/1150E/production/_103262907_somaliamogadishu9760918.png
Shreyashi   Sanyal,"(Reuters) - The S&amp;P 500 and the Dow Jones Industrials Average rose on Wednesday, helped by upbeat housing data and a gain for bank stocks driven by rising Treasury yields, while the tech-heavy Nasdaq was weighed by a drop in Microsoft. The benchmark 10-ye… [+3067 chars]","The S&P 500 and the Dow Jones Industrials Average rose on Wednesday, helped by upbeat housing data and a gain for bank stocks driven by rising Treasury yields, while the tech-heavy Nasdaq was weighed by a drop in Microsoft.",2018-09-19T17:12:14Z,"{'id': 'reuters', 'name': 'Reuters'}","Banks lift S&P, Dow; Nasdaq weighed by Microsoft",https://www.reuters.com/article/us-usa-stocks/banks-lift-sp-dow-nasdaq-weighed-by-microsoft-idUSKCN1LZ1IN,https://s3.reutersmedia.net/resources/r/?m=02&d=20180919&t=2&i=1306052027&w=1200&r=LYNXNPEE8I1T7
https://www.facebook.com/emily.wax.7,"Working through the night on little sleep and lots of Mountain Dew and adrenaline, Taylor Fontenot, the Texas captain of an-all volunteer group known as America’s Cajun Navy, headed right into Hurricane Florence’s wrath. As the storm headed toward land Thursd… [+7017 chars]","Washington Post Cajun Navy races to the Carolinas; citizen rescuers pull people from rising waters Washington Post Working through the night on little sleep and lots of Mountain Dew and adrenaline, Taylor Fontenot, the Texas captain of an-all volunteer group …",2018-09-14T16:37:41Z,"{'id': 'the-washington-post', 'name': 'The Washington Post'}",Cajun Navy races to the Carolinas; citizen rescuers pull people from rising waters - Washington Post,https://www.washingtonpost.com/national/cajun-navy-races-to-the-carolinas-citizen-rescuers-pull-people-from-rising-waters/2018/09/14/46623928-b763-11e8-a2c5-3187f427e253_story.html,https://www.washingtonpost.com/resizer/YkORWmPYxQwR4uV2QJ6JFOOvnDU=/1484x0/arc-anglerfish-washpost-prod-washpost.s3.amazonaws.com/public/TQLVM7FYHMI6RJ5VVWVKLMVFP4.jpg
Michael Bociurkiw,"Michael Bociurkiw is a global affairs analyst, at work on his first nonfiction book on screen and social media addiction. The opinions expressed in this commentary are his. View more opinions on CNN. (CNN) About 41 million Americans live in areas that have a … [+6862 chars]","In vulnerable areas, such as South Florida, homeowners could see their properties literally under water within their lifetimes, writes Michael Bociurkiw. Rather than curbing building in vulnerable areas,  jurisdictions such as Miami Beach have opted to spend …",2018-09-21T23:48:12Z,"{'id': 'cnn', 'name': 'CNN'}",Homeowners who live on the coast are sleepwalking toward climate catastrophe,https://www.cnn.com/2018/09/21/opinions/coastal-communities-are-sleepwalking-toward-catastrophe-bociurkiw/index.html,https://cdn.cnn.com/cnnnext/dam/assets/180920235124-01-florence-flooding-0920-super-tease.jpg
Yanis Varoufakis,Our era will be remembered for the triumphant march of a globally unifying rightwing – a Nationalist International – that sprang out of the cesspool of financialised capitalism. Whether it will also be remembered for a successful humanist challenge to this me… [+6758 chars],"Everywhere we look, nationalists are on the rise. The discredited establishment can’t get us out of this mess – only we can Our era will be remembered for the triumphant march of a globally unifying rightwing – a Nationalist International – that sprang out of…",2018-09-13T17:02:11Z,"{'id': 'the-guardian-au', 'name': 'The Guardian (AU)'}",Our new international movement will fight rising fascism and globalists | Yanis Varoufakis,https://www.theguardian.com/commentisfree/ng-interactive/2018/sep/13/our-new-international-movement-will-fight-rising-fascism-and-globalists,https://i.guim.co.uk/img/media/ad210a715fe4de617791671608705f9c8f34ab9d/0_0_3000_1800/master/3000.jpg?width=1200&height=630&quality=85&auto=format&usm=12&fit=crop&crop=faces%2Centropy&bm=normal&ba=bottom%2Cleft&blend64=aHR0cHM6Ly9hc3NldHMuZ3VpbS5jby51ay9pbWFnZXMvb3ZlcmxheXMvNTM4OGZjODViNTQ0N2E4M2NmMWNlMTg5YTVhMjE1NzMvdGctb3BpbmlvbnMucG5n&s=dcb7848d8dc31886b4c8668a1c414aa8
,"Marty Smith and Ryan McGee have almost dried out from a rain-soaked adventure in Tallahassee on Monday night, and they're still talking ball on Marty &amp; McGee every Thursday night (7 p.m. ET, SEC Network, also on demand on the ESPN app). The Idiots' Guide … [+225 chars]","Finally dried out after the Florida State-Virginia Tech game, the guys discussed Lane Kiffin's assessment of Oklahoma's greatness and their love of sporting equipment.",2018-09-07T16:50:49Z,"{'id': None, 'name': 'Espn.com'}","Marty and McGee's Idiots' Guide sees Sooners rising, UCLA rebuilding",http://www.espn.com/college-football/story/_/id/24606149/marty-smith-ryan-mcgee-guide-weekend-week-2,http://a2.espncdn.com/combiner/i?img=%2Fphoto%2F2018%2F0901%2Fr424563_1296x729_16%2D9.jpg
Michael Biesecker / AP,"About 3.4 million chickens and turkeys and 5,500 hogs have been killed in flooding from Florence as rising North Carolina rivers swamped dozens of farm buildings where the animals were being raised for market, according to state officials. The N.C. Department… [+5077 chars]",Rising North Carolina rivers swamped dozens of farm buildings where the animals were being raised for market,2018-09-19T11:55:58Z,"{'id': 'time', 'name': 'Time'}","3.4 Million Chickens and Turkeys and 5,500 Hogs Have Died in Flooding From Florence",http://time.com/5400429/florence-poultry-hogs/,https://timedotcom.files.wordpress.com/2018/09/florence-flood-poultry-hog.jpg?quality=85
,All it takes is a glance at a current satellite image of the Earth to recognize that we're currently in the midst of several meteorological events. A wide-ranging cluster of clouds indicates a typhoon that has hit the Philippines; on the other side of the wor… [+4041 chars],"A staggering number of major airports are located in low-lying areas near water, posing a significant risk from rising sea temperatures and the superstorms they fuel",2018-09-17T20:40:53Z,"{'id': None, 'name': 'Yahoo.com'}",Unlikely Victims of Climate Change Include Major International Airports,https://www.yahoo.com/news/unlikely-victims-climate-change-major-204053611.html,https://s.yimg.com/uu/api/res/1.2/vVaWtmYQdXlTMWcSNITclQ--~B/aD0xOTgxO3c9Mjk3MTtzbT0xO2FwcGlkPXl0YWNoeW9u/http://media.zenfs.com/en-US/homerun/architectural_digest_422/d7cc8bc1e7123da3a5811011767ee3c4
Reuters,"NEW YORK (Reuters) - The Democratic congressman aiming to unseat Republican U.S. Senator Ted Cruz in Texas has pulled even in the race, a Reuters poll found, a spark of hope for a party seeking a Senate majority to curb President Donald Trump's agenda. The Re… [+2723 chars]","William Philpott/Reuters Democratic congressman aiming to unseat Republican U.S. Senator Ted Cruz in Texas has pulled even in the race, a Reuters poll found. Beto O'Rourke lead Ted Cruz by two points in a recent poll, but the poll has a four point margin of e…",2018-09-19T10:52:46Z,"{'id': 'business-insider', 'name': 'Business Insider'}","Ted Cruz, in deep red Texas, is at risk of losing to rising Democrat star Beto O'Rourke, poll shows",https://www.businessinsider.com/poll-shows-ted-cruz-at-risk-of-losing-to-rising-democrat-beto-orourke-2018-9,https://amp.businessinsider.com/images/5a9eb8245cc41007038b465f-1136-568.jpg
ANDREW R. CHOW,"A rescue team arrived at the scene, between the towns of Mullins and Nichols — about a half mile from the rising Little Pee Dee River — and took the deputies to safety. Mr. Richardson described the two women who died as patients who were being taken from McLe… [+908 chars]","Flooding during Tropical Storm Florence last week in North Myrtle Beach, S.C.",2018-09-19T04:31:12Z,"{'id': 'the-new-york-times', 'name': 'The New York Times'}",2 Patients Die in Sheriff’s Van Submerged by Florence’s Floodwaters,https://www.nytimes.com/2018/09/19/us/florence-deaths-south-carolina-van.html,https://static01.nyt.com/images/2018/09/20/us/20xp-vandeaths2/20xp-vandeaths2-facebookJumbo.jpg
MICHAEL D. SHEAR,"In recent weeks, Sam Nunberg, a former Trump aide, speculated that Mr. Graham might be Mr. Trumps choice to become attorney general if the president fires Jeff Sessions from the post. And on Thursday, Mr. Graham became the fiercest defender of the presidents … [+1200 chars]","Continuing to shed his maverick credentials, the South Carolina Republican told his Democratic Senate colleagues, “What you want to do is destroy this guy’s life.”",2018-09-27T23:41:50Z,"{'id': 'the-new-york-times', 'name': 'The New York Times'}",Furious Lindsey Graham Calls Kavanaugh Hearing ‘the Most Unethical Sham’,https://www.nytimes.com/2018/09/27/us/politics/lindsey-graham-kavanaugh-hearing.html,https://static01.nyt.com/images/2018/09/28/us/politics/28dc-graham-print/28dc-graham-facebookJumbo.jpg
Cory Doctorow,"In 2012, North Carolina's Coastal Resources Commission studied the question of sea-level rise and the likelihood that coastal areas would be inundated by severe weather, concluding that the seas were likely to rise by 39"" over the century; the Republican legi… [+2982 chars]","In 2012, North Carolina's Coastal Resources Commission studied the question of sea-level rise and the likelihood that coastal areas would be inundated by severe weather, concluding that the seas were likely to rise by 39"" over the century; the Republican legi…",2018-09-13T16:23:19Z,"{'id': None, 'name': 'Boingboing.net'}","Six years ago, North Carolina Republicans voted in a law decreeing that the seas weren't rising",https://boingboing.net/2018/09/13/north-canute.html,https://media.boingboing.net/wp-content/uploads/2018/09/2006Flood_NisquallyAtLongmire_web.jpeg
BINYAMIN APPELBAUM,"State and local governments in the Southeast have ardently pursued Chinese investment in recent years, but it is far from clear that the Trump administration would welcome an influx of Chinese companies in response to its tariffs. The administration, which ca… [+1398 chars]","After the United States imposed tariffs on Chinese tires in 2009, Chinese companies started building plants in the United States.",2018-09-17T21:51:36Z,"{'id': 'the-new-york-times', 'name': 'The New York Times'}",Trump Says Tariffs Will Save American Factories. History Shows Otherwise.,https://www.nytimes.com/2018/09/17/us/politics/trump-tariffs-american-factories.html,https://static01.nyt.com/images/2018/09/17/us/17dc-tariffs1/17dc-tariffs-facebookJumbo.jpg
GIOVANNI RUSSONELLO,"Born in 1942 in the tiny hamlet of Blackwell, Ark., Ms. Myers grew up playing the piano at Baptist and Methodist church functions, and leading gospel quartets. After graduating from college, she moved to Chicago and in 1966 joined the A.A.C.M., a newly formed… [+1106 chars]","Amina Claudine Myers has recorded 11 albums as a leader since 1979. In October, she’ll debut a new program at the Community Church in Midtown.",2018-09-14T13:00:05Z,"{'id': 'the-new-york-times', 'name': 'The New York Times'}","Amina Claudine Myers, a Singer Who Still Needs No Words",https://www.nytimes.com/2018/09/14/arts/music/amina-claudine-myers-gospel.html,https://static01.nyt.com/images/2018/09/16/arts/16AMINA1/16AMINA1-facebookJumbo.jpg
