author,content,description,publishedAt,source,title,url,urlToImage
Press Association,"The archbishop of Canterbury has suggested the rollout of universal credit should be halted because it has left people worse off. Justin Welby received a standing ovation at the TUC congress in Manchester when he criticised the benefits system, said the livin… [+2508 chars]",Archbishop of Canterbury says introduction of benefit has fuelled food bank use and debt The archbishop of Canterbury has suggested the rollout of universal credit should be halted because it has left people worse off. Justin Welby received a standing ovation…,2018-09-12T11:16:22Z,"{'id': 'the-guardian-au', 'name': 'The Guardian (AU)'}",Justin Welby suggests universal credit rollout should be halted,https://www.theguardian.com/uk-news/2018/sep/12/justin-welby-universal-credit-rollout-halted-food-banks,https://i.guim.co.uk/img/media/efa6be18c7ba52044dc747844f270dad36fb8dba/0_809_2213_1327/master/2213.jpg?width=1200&height=630&quality=85&auto=format&usm=12&fit=crop&crop=faces%2Centropy&bm=normal&ba=bottom%2Cleft&blend64=aHR0cHM6Ly9hc3NldHMuZ3VpbS5jby51ay9pbWFnZXMvb3ZlcmxheXMvZDM1ODZhNWVmNTc4MTc1NmQyMWEzYjYzNWU1MTcxNDEvdGctZGVmYXVsdC5wbmc&s=ef2e4ee9b16773e1284ecc308615c4ad
Reuters Editorial,"WASHINGTON (Reuters) - U.S. industrial production rose in August, as strong output in auto manufacturing offset lackluster production in the rest of the factory sector. The Federal Reserve said on Friday industrial production rose 0.4 percent last month after… [+1874 chars]","U.S. industrial production rose in August, as strong output in auto manufacturing offset lackluster production in the rest of the factory sector.",2018-09-14T13:20:44Z,"{'id': 'reuters', 'name': 'Reuters'}",U.S. auto sector output boosts industrial production,https://www.reuters.com/article/us-usa-economy-output/u-s-auto-sector-output-boosts-industrial-production-idUSKCN1LU1UF,https://s3.reutersmedia.net/resources/r/?m=02&d=20180914&t=2&i=1304323966&w=1200&r=LYNXNPEE8D18N
yoav vilner,"The Internet-of-Things (IoT) is revolutionizing markets and businesses today. Manufacturers are reaping the benefits of having interconnected devices. According to McKinsey, use of IoT in factories can create as much as $3.7 trillion in value by 2025. But IoT… [+5541 chars]","The Internet-of-Things (IoT) is revolutionizing markets and businesses today. Manufacturers are reaping the benefits of having interconnected devices. According to McKinsey, use of IoT in factories can create as much as $3.7 trillion in value by 2025. But IoT…",2018-09-07T18:00:13Z,"{'id': None, 'name': 'Readwrite.com'}",Why Small Businesses Need to Be Vigilant About IoT Security Too,https://readwrite.com/2018/09/07/why-small-businesses-need-to-be-vigilant-about-iot-security-too/,https://images.readwrite.com/wp-content/uploads/2018/05/IoT-Healthcare.jpeg
"Yanis Varoufakis, Ann Pettifor, Mark Littlewood, David Blanchflower, Olli Rehn, Nicky Morgan, and Micah White","Yanis Varoufakis : Risk has not been diminished, just taken out of sight Ten years after its near-death experience, capitalism is back to its old ways. Bailouts for the few and austerity for the many have caused global debt to rise 40% since 2007. Yes, Britis… [+14720 chars]",Our panel of writers considers what has changed – and what still needs to Continue reading...,2018-09-14T11:04:01Z,"{'id': 'the-guardian-au', 'name': 'The Guardian (AU)'}",Lehman Brothers 10 years on panel | Nicky Morgan and others,https://www.theguardian.com/commentisfree/2018/sep/14/the-panel-lehman-brothers-ten-year-anniversary-financial-crash,https://i.guim.co.uk/img/media/5d87f461b93a33a9d5b7326b74a56736864fcfed/0_186_3120_1872/master/3120.jpg?width=1200&height=630&quality=85&auto=format&usm=12&fit=crop&crop=faces%2Centropy&bm=normal&ba=bottom%2Cleft&blend64=aHR0cHM6Ly9hc3NldHMuZ3VpbS5jby51ay9pbWFnZXMvb3ZlcmxheXMvNTM4OGZjODViNTQ0N2E4M2NmMWNlMTg5YTVhMjE1NzMvdGctb3BpbmlvbnMucG5n&s=5ffa58a391fb9522d135d87a96006759
Reuters,The internal whistleblower who helped reveal alleged money laundering at Danske Banks Estonian branch was reportedly a British former head of its trading business in the Baltics. Howard Wilkinson headed the banks Danske Markets trading unit in the Baltics fro… [+2336 chars],Howard Wilkinson confirmed his role in email to the Danish newspaper Berlingske after Briton was named by Estonian media The internal whistleblower who helped reveal alleged money laundering at Danske Bank’s Estonian branch was reportedly a British former hea…,2018-09-26T14:23:52Z,"{'id': 'the-guardian-au', 'name': 'The Guardian (AU)'}",Danske Bank whistleblower was ex-Baltics trading head,https://www.theguardian.com/world/2018/sep/26/danske-bank-whistleblower-was-ex-baltics-trading-head-howard-wilkinson,https://i.guim.co.uk/img/media/ccfeedf85396e559c9aa61e818d30dd9d20d7b19/0_134_3500_2101/master/3500.jpg?width=1200&height=630&quality=85&auto=format&fit=crop&crop=faces%2Centropy&bm=normal&ba=bottom%2Cleft&blend64=aHR0cHM6Ly9hc3NldHMuZ3VpbS5jby51ay9pbWFnZXMvb3ZlcmxheXMvZDM1ODZhNWVmNTc4MTc1NmQyMWEzYjYzNWU1MTcxNDEvdGctZGVmYXVsdC5wbmc&s=03086005c5266926cb3bec75203a3f73
"AP, AP","BARCELONA, Spain (AP) Spanish soccer has another spat on its hands. The national soccer federation took issue with the Spanish league over its management strategy for the second time this week when it criticized the scheduling of games during what it consider… [+4209 chars]",The Spanish soccer federation took issue with the Spanish league over its management strategy for the second time this week when it criticized the scheduling of games during what it considered the excessive heat of daytime,2018-09-24T04:23:43Z,"{'id': 'usa-today', 'name': 'USA Today'}",Spat in Spanish soccer over playing during daytime heat,https://www.usatoday.com/story/sports/soccer/2018/09/24/spat-in-spanish-soccer-over-playing-during-daytime-heat/37916637/?utm_source=google&utm_medium=amp&utm_campaign=speakable,https://www.gannett-cdn.com/GDContent/applogos/usatoday.png
,"New research suggests that obesity changes how airway muscles function, increasing the risk of developing asthma. The study is published ahead of print in the American Journal of Physiology -- Lung Cellular and Molecular Physiology. The prevalence of asthma a… [+1930 chars]","Obesity changes how airway muscles function, increasing the risk of developing asthma, a new study suggests.",2018-09-13T15:39:01Z,"{'id': None, 'name': 'Sciencedaily.com'}","Obesity alters airway muscle function, increases asthma risk",https://www.sciencedaily.com/releases/2018/09/180913113901.htm,
Ernest Scheyder,"WILMINGTON/FAYETTEVILLE, N.C. (Reuters) - Rescue teams were trying to reach hundreds of people on Monday and racing against rising rivers and floods that could last for days after Florence dumped record rain on the Carolinas and killed at least 31 people. Tho… [+3919 chars]",Rescue teams were trying to reach hundreds of people on Monday and racing against rising rivers and floods that could last for days after Florence dumped record rain on the Carolinas and killed at least 31 people.,2018-09-18T00:33:29Z,"{'id': 'reuters', 'name': 'Reuters'}",Carolinas brace for days of floods after Florence's deluge,https://www.reuters.com/article/us-storm-florence/carolinas-brace-for-days-of-floods-after-florences-deluge-idUSKCN1LX126,https://s3.reutersmedia.net/resources/r/?m=02&d=20180917&t=2&i=1305399733&w=1200&r=LYNXNPEE8G1MM
"Yessenia Funes on Earther, shared by Andrew Couts to Gizmodo","On Tuesday, the Trump administration took the long-anticipated step of reversing an Obama-era rule that would’ve helped prevent leaking, venting, and flaring of methane from oil and gas operations. The rollback doesn’t just kill the final piece of Obama’s cli… [+4435 chars]","On Tuesday, the Trump administration took the long-anticipated step of reversing an Obama-era rule that would’ve helped prevent leaking, venting, and flaring of methane from oil and gas operations. The rollback doesn’t just kill the final piece of Obama’s cli…",2018-09-19T18:52:00Z,"{'id': None, 'name': 'Gizmodo.com'}",Trump's Methane Rule Rollback Will Make More People Sick,https://earther.gizmodo.com/trumps-methane-rule-rollback-will-make-more-people-sick-1829173317,"https://i.kinja-img.com/gawker-media/image/upload/s--Hygyg6dv--/c_fill,fl_progressive,g_center,h_900,q_80,w_1600/xuvr4vxoydxmppryqab6.jpg"
Graham Rapier,Paul Sancya / AP Moody's downgraded Ford 's bonds to one level above junk status this week — a move that has even the automaker's biggest fans worried. Adam Jonas of Morgan Stanley writes that there's still room for Ford to execute on it's plan — if only he k… [+1896 chars],Moody's downgraded Ford 's bonds to one level above junk status this week — a move that has even the automaker's biggest fans worried. Adam Jonas of Morgan Stanley writes that there's still room for Ford to execute on it's plan — if only he knew what that pla…,2018-08-31T17:40:00Z,"{'id': 'business-insider', 'name': 'Business Insider'}",Ford 'must execute significant structural change' (F),https://www.businessinsider.com/ford-stock-price-must-execute-significant-structural-change-morgan-stanley-2018-8,https://static1.businessinsider.com/image/5b8971fb64dce81d008b57df-2400/ap17143725244391.jpg
Tom McKay,"Google’s widely reported search engine prototype for China, which is allegedly code-named Dragonfly, not only blacklists search terms to comply with the wishes of government censors but ties all searches to devices’ phone numbers, according to a report on Fri… [+4251 chars]","Google’s widely reported search engine prototype for China, which is allegedly code-named Dragonfly, not only blacklists search terms to comply with the wishes of government censors but ties all searches to devices’ phone numbers, according to a report on Fri…",2018-09-15T21:20:00Z,"{'id': None, 'name': 'Gizmodo.com'}","Report: Google's Chinese Search Prototype Logs Phone Numbers, Hides Unapproved Pollution Data",https://gizmodo.com/report-googles-chinese-search-prototype-logs-phone-num-1829085277,"https://i.kinja-img.com/gawker-media/image/upload/s--2qxM-Tkr--/c_fill,fl_progressive,g_center,h_900,q_80,w_1600/zn0ejq46y1kcn4sjbwne.jpg"
"Tom McKay on Earther, shared by Tom McKay to Gizmodo","The 7.5-magnitude earthquake and subsequent tsunami that hit the eastern Indonesian island of Sulawesi on Friday is confirmed to have killed hundreds of people, the New York Times reported on Saturday, with at least 405 confirmed deaths in the city of Palu an… [+4766 chars]","The 7.5-magnitude earthquake and subsequent tsunami that hit the eastern Indonesian island of Sulawesi on Friday is confirmed to have killed hundreds of people, the New York Times reported on Saturday, with at least 405 confirmed deaths in the city of Palu an…",2018-09-30T01:00:00Z,"{'id': None, 'name': 'Gizmodo.com'}","Hundreds Confirmed Dead in Indonesian Tsunami, With Officials Warning Toll Will Rise",https://earther.gizmodo.com/hundreds-confirmed-dead-in-indonesian-tsunami-with-off-1829418344,"https://i.kinja-img.com/gawker-media/image/upload/s--LPlOPBzX--/c_fill,fl_progressive,g_center,h_900,q_80,w_1600/ce3trc7q8gubvqmailnv.png"
Joyce Yang,"While United States regulators are still trying to figure out how to think about cryptocurrencies, Thailand’s government is already mapping out its own central bank digital currency. This is just one of numerous examples how Thailand has emerged as one the mo… [+8199 chars]","While United States regulators are still trying to figure out how to think about cryptocurrencies, Thailand’s government is already mapping out its own central bank digital currency. This is just one of numerous examples how Thailand has emerged as one the mo…",2018-09-01T00:13:45Z,"{'id': 'techcrunch', 'name': 'TechCrunch'}",Thailand is becoming a critical country for blockchain,http://techcrunch.com/2018/08/31/thailand-blockchain/,https://techcrunch.com/wp-content/uploads/2018/08/GettyImages-840859200.jpg?w=599
Will Rhind,"August 31, 2018 6 min read Opinions expressed by Entrepreneur contributors are their own. There are two paths to becoming an entrepreneur. The first is the dream scenario: Have a great idea, set up a company, enjoy instant overnight success and become rich, f… [+6222 chars]",Follow these five tips to set yourself up for success on the path to entrepreneurship.,2018-08-31T18:30:00Z,"{'id': None, 'name': 'Entrepreneur.com'}",How to Make the Leap from CEO to Entrepreneur,https://www.entrepreneur.com/article/318559,https://assets.entrepreneur.com/content/3x2/2000/20180829224208-GettyImages-638685153.jpeg
Tom Nardi,"The modern Internet can be a dangerous place, especially for those who might not have the technical wherewithal to navigate its pitfalls. Whether it’s malware delivered to your browser through a “drive-by” or online services selling your data to the highest b… [+4655 chars]","The modern Internet can be a dangerous place, especially for those who might not have the technical wherewithal to navigate its pitfalls. Whether it’s malware delivered to your browser through a “drive-by” or online services selling your data to the highest b…",2018-09-03T14:01:23Z,"{'id': None, 'name': 'Hackaday.com'}",FOSSCON 2018: Developing the FreedomBox,https://hackaday.com/2018/09/03/fosscon-2018-developing-the-freedombox/,https://hackadaycom.files.wordpress.com/2018/08/freebox_feat.png
Greg Robb,"Roger Ferguson, chief executive officer of Teachers Insurance &amp; Annuity Association of America, says the Fed is moving away from its long held policy of low interest rates and markets may not be ready. Investors might not fully understand that the Federal… [+2426 chars]","The Fed is moving away from its low-interest-rate regime and there is a risk that investors remain surprised, according to Roger Ferguson, the CEO of TIAA.",2018-09-07T16:46:11Z,"{'id': None, 'name': 'Marketwatch.com'}","The Fed: There’s a risk that the Fed and stock market aren’t in sync, former vice chairman warns",https://www.marketwatch.com/story/theres-a-risk-that-the-fed-and-stock-market-arent-in-sync-former-vice-chairman-warns-2018-09-07,http://s.marketwatch.com/public/resources/MWimages/MW-GP672_fergus_ZG_20180907092557.jpg
Brett,"If you found yourself in a situation with a violent attacker, would you know what to do? While it’s easy to think you’d instinctively make the right decision, the truth is, if you haven’t been formulating and practicing a plan ahead of time, you’ll likely mak… [+2404 chars]","If you found yourself in a situation with a violent attacker, would you know what to do? While it’s easy to think you’d instinctively make the right decision, the truth is, if you haven’t been formulating and practicing a plan ahead of time, you’ll likely mak…",2018-09-05T16:27:33Z,"{'id': None, 'name': 'Artofmanliness.com'}",Podcast #438: Developing Real-World Situational Awareness,https://www.artofmanliness.com/articles/podcast-438-developing-real-world-situational-awareness/,https://content.artofmanliness.com/uploads/2018/09/Screen-Shot-2018-09-05-at-5.02.51-AM.png
"Andrew Mayeda, Josh Wingrove and Eric Martin / Bloomberg","(Bloomberg) — Talks between the U.S. and Canada ended Friday without a deal on a new North American Free Trade Agreement, but discussions are expected to continue next week, according to a person familiar with the matter. Canadian Foreign Affairs Minister Chr… [+1290 chars]",Canada has been clear about its 'red lines' around NAFTA,2018-08-31T20:19:31Z,"{'id': 'time', 'name': 'Time'}",U.S. and Canada End Friday Without Reaching a Deal on New NAFTA,http://time.com/5384555/us-canada-nafta/,https://timedotcom.files.wordpress.com/2018/08/canada-us-resume-trade-talks.jpg?quality=85
Eli Meixler,"A 6.3 magnitude earthquake shook a remote area of central Ecuador Thursday, causing minor damage and regional blackouts and injuring one person, Reuters reports. The earthquake struck the South American country about 94 km (58 miles) south of the city of Amba… [+1090 chars]",The quake caused minor damage and regional blackouts,2018-09-07T06:42:35Z,"{'id': 'time', 'name': 'Time'}","6.3-Magnitude Earthquake Rattles Ecuador, Toppling Power Lines and Injuring One",http://time.com/5389687/ecuador-earthquake-ambato-damage/,https://timedotcom.files.wordpress.com/2017/08/time-logo.jpg?quality=85
Sanjiv Das,"I remember it like it was yesterday. Ten years ago, the collapse of Lehman Brothers pulled the U.S. financial system, as well as the U.S. economy, into the abyss. I was still relatively new to my job, having become CEO of CitiMortgage in July 2008. But after … [+4962 chars]","Responsible lending, leadership, and risk-control are key to averting another meltdown, writes Sanjiv Das.",2018-09-17T20:02:40Z,"{'id': None, 'name': 'Marketwatch.com'}",Outside the Box: Ex-CitiMortgage CEO: 3 things I learned from the 2008 Great Financial Crisis,https://www.marketwatch.com/story/ex-citimortgage-ceo-3-things-i-learned-from-the-2008-great-financial-crisis-2018-09-17,http://s.marketwatch.com/public/resources/MWimages/MW-GP593_housin_ZG_20180906103700.jpg
Gina Martinez,"California’s Delta Fire has continued to spread, shutting down 50 miles of I-5 as passengers were forced to abandon their cars and flee to safety. The wildfire, which started near Lake Shasta last Wednesday, has already burned through 25 square miles. On Wedn… [+1634 chars]",See a map of the Delta Fire that's expected to keep spreading,2018-09-06T20:35:35Z,"{'id': 'time', 'name': 'Time'}","California Wildfire Map: Delta Fire Closes Down 50 Miles of I-5, Showing No Sign of Slowing",http://time.com/5389049/delta-fire-california-map/,https://timedotcom.files.wordpress.com/2018/09/gettyimages-1027528794.jpg?quality=85
Joe Ciolli,"Auditors can be intimidating. In the corporate world, their role is to make sure financials are compliant with accounting standards. And as a result, they're often viewed as rigid, if not infallible, purveyors of accuracy. While Deutsche Bank doesn't necessar… [+4460 chars]","A new report from Deutsche Bank challenges conventional views of auditing, and argues there are several improvements that can be made to the industry. Research analyst Luke Templeman lays out five ""radical"" suggestions for how the auditing industry can be cha…",2018-09-05T10:03:00Z,"{'id': 'business-insider', 'name': 'Business Insider'}",DEUTSCHE BANK: These 5 radical ideas could give the $150 billion auditing industry a much-needed shake-up,https://www.businessinsider.com/5-radical-ideas-to-reform-the-auditing-industry-deutsche-bank-2018-9,https://amp.businessinsider.com/images/5b8ecdfb959f341e2e8b56b6-1920-960.jpg
,Sand is used to create an elevation profile in the laboratory. A scanner automatically detects it and projects colour-coded contour lines onto it. Virtual rain can be triggered over the sandy landscape with special hand movements. Credit: Damian Gorczany Engi… [+3684 chars],"Engineers at Ruhr-Universität Bochum have developed a new statistical model that predicts how likely extreme flood events are in Germany. In contrast to earlier models, they distinguish between several types of floods with different causes, such as heavy rain…",2018-09-17T13:50:01Z,"{'id': None, 'name': 'Phys.org'}",Predicting flood risk better,https://phys.org/news/2018-09-predicting-flood-risk-better.html,https://3c1703fe8d.site.internapcdn.net/newman/gfx/news/hires/2018/5b9fa809d7a7e.jpg
https://www.facebook.com/bbcnews,Image copyright AFP Image caption Forecasters say the hurricane will certainly hit the US coastline Evacuations have been ordered as the US East Coast braces for Hurricane Florence - in what may be the strongest storm to hit the region in two decades. South C… [+5589 chars],"The ""extremely dangerous"" Florence is now a category three storm, and gaining strength.",2018-09-10T15:43:19Z,"{'id': 'bbc-news', 'name': 'BBC News'}",Hurricane Florence: 'Extremely dangerous' storm threatens East Coast,https://www.bbc.co.uk/news/world-us-canada-45474706,https://ichef.bbci.co.uk/news/1024/branded_news/35D0/production/_103367731_tv049191599.jpg
https://www.facebook.com/bbcnews,"US officials are warning Hurricane Florence could kill ""a lot of people"" with risks of ""catastrophic"" flooding as the storm begins to lash the country's East Coast. Florence, although now downgraded to a category one storm, is slow-moving and could linger for… [+4953 chars]","Satellite images, maps and graphics showing where the category one storm will hit and the impact it is expected to have.",2018-09-14T08:59:12Z,"{'id': 'bbc-news', 'name': 'BBC News'}",Where will Hurricane Florence hit?,https://www.bbc.co.uk/news/world-us-canada-45511312,https://ichef.bbci.co.uk/news/1024/branded_news/747E/production/_103422892_florence_1830_12_sept_label-nc.png
Hannah Summers,"A nightclub in Bournemouth was evacuated in the early hours of Saturday morning after a canister of suspected teargas was released. As many as 40 people suffering from sickness, coughing fits and itchy eyes were treated at the scene by paramedics after the CS… [+1799 chars]",Up to 40 people treated by paramedics after spray was apparently released at Cameo club A nightclub in Bournemouth was evacuated in the early hours of Saturday morning after a canister of suspected teargas was released. As many as 40 people suffering from sic…,2018-09-29T08:22:06Z,"{'id': 'the-guardian-au', 'name': 'The Guardian (AU)'}",Bournemouth nightclub evacuated after 'teargas' released,https://www.theguardian.com/uk-news/2018/sep/29/bournemouth-nightclub-evacuated-after-teargas-released,https://i.guim.co.uk/img/media/c60066e1e178cb71360e6ab032177b3f52af02e3/94_0_1660_996/master/1660.jpg?width=1200&height=630&quality=85&auto=format&fit=crop&crop=faces%2Centropy&bm=normal&ba=bottom%2Cleft&blend64=aHR0cHM6Ly9hc3NldHMuZ3VpbS5jby51ay9pbWFnZXMvb3ZlcmxheXMvZDM1ODZhNWVmNTc4MTc1NmQyMWEzYjYzNWU1MTcxNDEvdGctZGVmYXVsdC5wbmc&s=ac453c3a135c7841c8a7a1af2b392672
Dinah Voyles Pulver,"Volusia and Flagler counties escaped the window for a direct strike from a dangerous Hurricane Florence, with the hurricane forecast to make a landfall in the Carolinas this week. But the storm's big waves and rip currents already are having an impact on loca… [+4592 chars]","Daytona Beach News-Journal Surf conditions growing more dangerous along Volusia, Flagler coasts as Hurricane Florence strengthens Daytona Beach News-Journal Volusia and Flagler counties escaped the window for a direct strike from a dangerous Hurricane Florenc…",2018-09-10T03:22:30Z,"{'id': None, 'name': 'News-journalonline.com'}","Surf conditions growing more dangerous along Volusia, Flagler coasts as Hurricane Florence strengthens - Daytona Beach News-Journal",http://www.news-journalonline.com/article/20180909/NEWS/180907660,http://www.news-journalonline.com/storyimage/LK/20180909/NEWS/180907660/AR/0/AR-180907660.jpg
Gina Martinez,"As Tropical Storm Florence heads toward the U.S. coast, South Carolina Governor Henry McMaster declared a state of emergency on Saturday. McMaster said South Carolina residents should hope for the best but prepare for the worst. Florence is currently 1,600 mi… [+1470 chars]",McMaster said South Carolina residents should hope for the best but prepare for the worst,2018-09-08T20:05:59Z,"{'id': 'time', 'name': 'Time'}",South Carolina Governor Declares State of Emergency as Officials Expect Tropical Storm Florence to Strengthen,http://time.com/5390908/south-carolina-tropical-storm-florence-state-of-emergency/,https://timedotcom.files.wordpress.com/2018/09/img_0805.jpg?quality=85
Stephen Culp,"NEW YORK (Reuters) - The S&amp;P 500 and the Dow Jones industrial average rose on Wednesday, with the Dow hitting its highest closing level since late January as rising Treasury yields boosted the financial sector and trade worries subsided. The tech-heavy Na… [+2934 chars]","The S&P 500 and the Dow Jones industrial average rose on Wednesday, with the Dow hitting its highest closing level since late January as rising Treasury yields boosted the financial sector and trade worries subsided.",2018-09-19T20:42:33Z,"{'id': 'reuters', 'name': 'Reuters'}","S&P 500, Dow up as rising treasury yields boost banks",https://www.reuters.com/article/us-usa-stocks/sp-500-dow-up-as-rising-treasury-yields-boost-banks-idUSKCN1LZ1IN,https://s3.reutersmedia.net/resources/r/?m=02&d=20180919&t=2&i=1306052027&w=1200&r=LYNXNPEE8I1T7
Harriet McLeod,"CHARLESTON, S.C./RALEIGH, N.C. (Reuters) - Thousands of people in the Georgetown, South Carolina, area were urged to evacuate their homes on Tuesday as rainwater unleashed by Hurricane Florence surged down rivers, threatening to submerge some neighborhoods un… [+3475 chars]","s) - Thousands of people in the Georgetown, South Carolina, area were urged to evacuate their homes on Tuesday as rainwater unleashed by Hurricane Florence surged down rivers, threatening to submerge some neighborhoods under 10 feet of water.US",2018-09-26T00:53:16Z,"{'id': 'reuters', 'name': 'Reuters'}",Thousands told to flee as Florence-triggered floods wash into South Carolina,https://www.reuters.com/article/us-storm-florence/thousands-told-to-flee-as-florence-triggered-floods-wash-into-south-carolina-idUSKCN1M512G,https://s2.reutersmedia.net/resources/r/?m=02&d=20180926&t=2&i=1308201308&w=1200&r=LYNXNPEE8O1MD
