author,content,description,publishedAt,source,title,url,urlToImage
"Christopher P. Skroupa, Contributor, Christopher P. Skroupa, Contributor https://www.forbes.com/sites/christopherskroupa/","https://pixabay.com/en/husavik-iceland-port-boats-3654390/ Matthew Smith has a Bachelor of Arts in Political Science from the University of Melbourne, a Diploma of Education from LaTrobe University and a Masters in Sustainable Development from the Centre for … [+6641 chars]",Defining The Bounds of Nordic Sustainability Integration,2018-09-24T20:48:00Z,"{'id': None, 'name': 'Forbes.com'}",Defining The Bounds of Nordic Sustainability Integration,https://www.forbes.com/sites/christopherskroupa/2018/09/24/defining-the-bounds-of-nordic-sustainability-integration/,https://thumbor.forbes.com/thumbor/600x315/https%3A%2F%2Fblogs-images.forbes.com%2Fchristopherskroupa%2Ffiles%2F2018%2F09%2Fhusavik-3654390_1920-1200x800.jpg
Kyle Hodge,"Food for thought: the sneaker industry produces over 15 billion pairs of sneakers a year! That’s a lot of animal skin, rubber, glue, and plastics manufactured and fossil fuels burned to make your favorite pairs of kicks. As climate change becomes more and mor… [+1536 chars]","Food for thought: the sneaker industry produces over 15 billion pairs of sneakers a year! That’s a lot of animal skin, rubber, glue, and plastics manufactured and fossil fuels burned to make your favorite pairs of kicks. As climate change becomes more and mor…",2018-09-07T21:13:32Z,"{'id': None, 'name': 'Highsnobiety.com'}",‘From the Ground Up’ Explores How Sustainability Is Impacting the Sneaker Industry,https://www.highsnobiety.com/p/from-the-ground-up-sustainability/,https://static.highsnobiety.com/wp-content/uploads/2018/09/07184952/from-the-ground-up-sustainability-feat.jpg
"Fredda Herz Brown, Contributor, Fredda Herz Brown, Contributor https://www.forbes.com/sites/freddaherzbrown/","For family enterprise owners, providing a sense of steadiness at the helm with a clear vision, mission, and strategic plan for their holdings is essential but no longer sufficient for their journeys. Families who are able to grow (or even maintain) their ente… [+4822 chars]","For family enterprise owners, providing a sense of steadiness at the helm with a clear vision, mission, and strategic plan for their holdings is essential but no longer sufficient for their journeys.",2018-09-18T14:03:00Z,"{'id': None, 'name': 'Forbes.com'}",Resilience and Sustainability - An Inextricable Pair,https://www.forbes.com/sites/freddaherzbrown/2018/09/18/resilience-and-sustainability-an-inextricable-pair/,https://thumbor.forbes.com/thumbor/600x315/https%3A%2F%2Fspecials-images.forbesimg.com%2Fdam%2Fimageserve%2F991289960%2F960x0.jpg%3Ffit%3Dscale
Lynsey Chutel,"At New York Fashion Week this month, clothing made from cotton grown and handwoven in Burkina Faso and cut and sewn in Ghana featured on the ramp in a victory lap for sustainable fashion. With their Spring/Summer collection, Studio 189 showcased a lesson in e… [+6127 chars]","At New York Fashion Week this month, clothing made from cotton grown and handwoven in Burkina Faso and cut and sewn in Ghana featured on…",2018-09-23T09:00:40Z,"{'id': None, 'name': 'Qz.com'}","African fashion brands bring sustainability to the runway, but can they scale up and stay green?",https://qz.com/africa/1377528/african-fashion-brands-bring-sustainability-to-the-runway-but-can-they-scale-up-and-stay-green/,https://cms.qz.com/wp-content/uploads/2018/09/DSC2194.jpg?quality=75&strip=all&w=1400
Lauren Masur,"If you're mind-blowingly bored and are looking for a not-at-all-productive-but-very-illuminating way to pass the time, BOY do I have a riveting activity for you. Amazon updates their most popular products based on sales (in any department) every single hour. … [+1605 chars]","If you're mind-blowingly bored and are looking for a not-at-all-productive-but-very-illuminating way to pass the time, BOY do I have a riveting activity for you. Amazon updates their most popular products based on sales (in any department) every single hour. …",2018-09-10T14:30:00Z,"{'id': None, 'name': 'Thekitchn.com'}",Our Favorite Canned Tuna Is Also Amazon's Most Popular Canned Product — Shopping,https://www.thekitchn.com/popular-canned-item-on-amazon-tuna-261154,https://atmedia.imgix.net/a069eb499375254092cb9e2b68566d74cc20f3b7?w=1500&fit=max
Mark Hand,"Two leaders of the House Natural Resources Committee are continuing their crusade against environmental groups. This time they are targeting the World Resources Institute (WRI), a well-respected international environmental and climate research group, over its… [+5750 chars]","Two leaders of the House Natural Resources Committee are continuing their crusade against environmental groups. This time they are targeting the World Resources Institute (WRI), a well-respected international environmental and climate research group, over its…",2018-09-07T18:22:44Z,"{'id': None, 'name': 'Thinkprogress.org'}",House Republicans intensify campaign against environmental groups with overseas operations,https://thinkprogress.org/house-republicans-intensify-campaign-against-environmental-groups-with-overseas-operations-2eddb35ab406/,https://thinkprogress.org/wp-content/uploads/2018/09/Rob-Bishop-sends-letter-to-World-Resources-Institute.jpg?w=1280&h=720&crop=1
Adam Williams,"Thailand's International Sustainable Developmental Studies Institute (ISDSI) teaches American students about sustainability, so it makes sense that when it needed a new campus, it used shipping containers. A total of 17 containers were used for the main build… [+1813 chars]","Thailand's International Sustainable Developmental Studies Institute (ISDSI) teaches American students about sustainability, so it makes sense that when it needed a new campus, it used shipping containers. A total of 17 containers were used for the main build…",2018-09-27T14:00:10Z,"{'id': None, 'name': 'Newatlas.com'}",Shipping container-based campus leaves nothing to waste,https://newatlas.com/isdsi-campus-shipping-containers/56516/,https://img.newatlas.com/isdi-shipping-container-campus-4.JPG?auto=format%2Ccompress&ch=Width%2CDPR&fit=crop&h=347&q=60&rect=588%2C1053%2C4093%2C2302&w=616&s=3670eaf4a798366318a50e32280242b8
Marcus Baram,"Space starts 62 miles away, but in the past few months it has felt much closer. Just yesterday, a pair of Japanese robots may have landed on an asteroid, as part of the country’s research efforts and amid a surge in startups focused on asteroid mining. Last w… [+8396 chars]","This week, the UN begins a conference to start the long-overdue discussion on updating the 1967 Outer Space Treaty for a cosmos that has gotten a lot more complicated. Space starts 62 miles away, but in the past few months it has felt much closer. Read Full S…",2018-09-24T09:00:42Z,"{'id': None, 'name': 'Fastcompany.com'}",Inside the epic debate on rethinking our 50-year-old Outer Space Treaty,https://www.fastcompany.com/90240304/inside-the-epic-debate-on-rethinking-our-50-year-old-outer-space-treaty?partner=feedburner&utm_source=feedburner&utm_medium=feed&utm_campaign=Feed%3A+fastcompany%2Fheadlines+%28Fast+Company%29,"https://images.fastcompany.net/image/upload/w_1280,f_auto,q_auto,fl_lossy/wp-cms/uploads/2018/09/p-1-inside-the-epic-debate-on-rethinking-our-50-year-old-outer-space-treaty.jpg"
,"In a move bucking the Trump administration’s push to revive the coal industry, California Gov. Jerry Brown signed a bill Monday that drastically ups the state’s clean energy goals and commits to 100 percent zero-carbon emissions in just a few decades. The cru… [+1698 chars]","In a move bucking the Trump administration's push to revive the coal industry,",2018-09-10T17:30:13Z,"{'id': None, 'name': 'Yahoo.com'}",California Commits To 100 Percent Clean Energy By 2045,https://www.yahoo.com/news/california-commits-100-percent-clean-173013427.html,https://s.yimg.com/uu/api/res/1.2/Suk7EoUSf8vsDXQ64McvMg--~B/aD01NjM7dz0xMDA0O3NtPTE7YXBwaWQ9eXRhY2h5b24-/http://media.zenfs.com/en-US/homerun/the_huffington_post_584/bb2ccd83e5068b09e7e353253c87f5b3
Jules Yap,"We often hear of the phenomenal success of IKEA products. Case in point, the BILLY bookcase, sketched by Gillis Lundgren in 1978 on the back of a napkin. Now, there are 60-odd million BILLY bookcases in the world. That’s nearly one for every 100 people. And e… [+3025 chars]","We often hear of the phenomenal success of IKEA products. Case in point, the BILLY bookcase, sketched by Gillis Lundgren in 1978 on the back of a napkin. Now, there are 60-odd million BILLY bookcases in the world. That’s nearly one for every 100 people. And e…",2018-09-04T14:10:45Z,"{'id': None, 'name': 'Ikeahackers.net'}",This piece of furniture is one of the biggest IKEA fail,https://www.ikeahackers.net/2018/09/ikea-fail-biggest-mistake.html,https://i2.wp.com/www.ikeahackers.net/wp-content/uploads/2018/06/IKEA-store.png?fit=750%2C500&ssl=1
,"Vines won’t water themselves. Credit: NF Photography/Shutterstock Three thousand litres of water – that is the amount needed to produce the food each British person eats every day. This is according to a new study into the ""water footprint"" of diets in Wester… [+4413 chars]","Three thousand litres of water – that is the amount needed to produce the food each British person eats every day. This is according to a new study into the ""water footprint"" of diets in Western Europe, conducted by the European Commission and published in Na…",2018-09-11T13:10:01Z,"{'id': None, 'name': 'Phys.org'}","Meat-free diets could cut our 'water footprint' in half, say scientists",https://phys.org/news/2018-09-meat-free-diets-footprint-scientists.html,https://3c1703fe8d.site.internapcdn.net/newman/gfx/news/2018/meatfreediet.jpg
Paul Rees,T he response of one Premiership club official to the takeover bid of the league by the private equity company CVC was succinct: the devil will be in the detail. An immediate cash injection for each side of £17m was the lure but a halving of income from centr… [+5568 chars],The takeover’s threat to club independence and existing regulations may have prompted its failure but it has opened up a debate about how the game can brand and run itself better The response of one Premiership club official to the takeover bid of the league …,2018-09-13T12:01:18Z,"{'id': 'the-guardian-au', 'name': 'The Guardian (AU)'}",CVC’s Premiership bid may have been rejected but it could signal change | The Breakdown,https://www.theguardian.com/sport/2018/sep/13/cvc-premiership-bid-pave-way-for-change,https://i.guim.co.uk/img/media/5c95137f9098c779e74cd3207148ba4d5ce74b96/103_76_3397_2039/master/3397.jpg?width=1200&height=630&quality=85&auto=format&usm=12&fit=crop&crop=faces%2Centropy&bm=normal&ba=bottom%2Cleft&blend64=aHR0cHM6Ly9hc3NldHMuZ3VpbS5jby51ay9pbWFnZXMvb3ZlcmxheXMvZDM1ODZhNWVmNTc4MTc1NmQyMWEzYjYzNWU1MTcxNDEvdGctZGVmYXVsdC5wbmc&s=f867a40766bebd5e877f90c01e4a4fec
Aseem Malhotra,"W hen the Labour deputy leader, Tom Watson, told me hed found it relatively easy to los e 94lbs in 10 months after following the plan outlined in my book The Pioppi Diet, I felt we were close to a tipping point in reversing the twin epidemics of type 2 diabet… [+3584 chars]","To mark the 70th anniversary of the NHS, healthcare staff and residents in Tameside went sugar-free for 70 days When the Labour deputy leader, Tom Watson, told me he’d found it “relatively easy” to los e 94lbs in 10 months after following the plan outlined in…",2018-09-28T10:53:22Z,"{'id': 'the-guardian-au', 'name': 'The Guardian (AU)'}",What can the town that gave up sugar teach us about diabetes and obesity? | Aseem Malhotra,https://www.theguardian.com/society/2018/sep/28/town-gave-up-sugar-diabetes-obesity,https://i.guim.co.uk/img/media/3ab18dc5d0c7638a1c9ff6035a51c5f1626d047e/0_23_5760_3456/master/5760.jpg?width=1200&height=630&quality=85&auto=format&fit=crop&crop=faces%2Centropy&bm=normal&ba=bottom%2Cleft&blend64=aHR0cHM6Ly9hc3NldHMuZ3VpbS5jby51ay9pbWFnZXMvb3ZlcmxheXMvNTM4OGZjODViNTQ0N2E4M2NmMWNlMTg5YTVhMjE1NzMvdGctb3BpbmlvbnMucG5n&s=5837c21cfd36def9217803857c173c44
"Rana Good, Contributor, Rana Good, Contributor https://www.forbes.com/sites/ranagood/","As much as I love to traverse the globe, I’m aware that travel can be harmful for the planet. Depending on the mode of transportation I use I’m increasing carbon emissions, using single-use plastic that can end up in landfills and potentially interfering with… [+12549 chars]",Sustainability blogger Laura Baross tells us how we can make travel less harmful for the planet.,2018-09-12T11:31:00Z,"{'id': None, 'name': 'Forbes.com'}",How To Make Your Travels More Sustainable,https://www.forbes.com/sites/ranagood/2018/09/12/how-to-make-your-travels-more-sustainable/,https://thumbor.forbes.com/thumbor/600x315/https%3A%2F%2Fblogs-images.forbes.com%2Franagood%2Ffiles%2F2018%2F09%2FLaura-Baross.jpg
"info@hypebeast.com (HYPEBEAST), HYPEBEAST","Remaining largely the same since its original release in 1972, the Nike Cortez recently received a brand new women’s exclusive sustainability-focused makeover. Part of the kickoff of the sportswear brand’s Flyleather initiative, the latest take on the classic… [+648 chars]","Remaining largely the same since its original release in 1972, the Nike Cortez recently received a brand new women's exclusive sustainability-focused makeover. Part of the kickoff of the sportswear brand's Flyleather initiative, the latest take on the classic…",2018-09-12T07:00:34Z,"{'id': None, 'name': 'Hypebeast.com'}",Nike's Cortez Model Is Reimagined in Flyleather,https://hypebeast.com/2018/9/nike-cortez-flyleather-release,https://image-cdn.hypb.st/https%3A%2F%2Fhypebeast.com%2Fimage%2F2018%2F09%2Ftw1-nike-cortez-flyleather-1.jpg?w=960&cbr=1&q=90&fit=max
Darian McBain,"You might assume sustainability is not at the top of consumers’ agendas. But in fact, 72 percent of seafood consumers choose brands based on sustainability over price, according to a recent study by the Marine Stewardship Council (MSC). Unilever has predicted… [+6331 chars]",Increasing demands are being placed on fishing companies to meet sustainability targets. Some are investigating technology-based strategies including the use of the blockchain ledger.,2018-09-25T19:51:26Z,"{'id': None, 'name': 'Iotworldtoday.com'}",How the Blockchain Ledger Can Drive Sustainability in Fishing,https://www.iotworldtoday.com/2018/09/25/how-the-blockchain-ledger-can-drive-sustainability-in-fishing/,https://www.itprotoday.com/sites/itprotoday.com/files/GettyImages-915139676-1.jpg
Gavin Clarke,"We're digging into rare earth minerals with The Register 's next Lecture in October. Dr Teal Riley, head of the Geological Mapping Group at the British Antarctic Survey, will discuss with Register readers a joint University of Cambridge project which hopes to… [+1221 chars]","Pipe down, Michael Stipe, we want tech's precious rock star We're digging into rare earth minerals with The Register 's next Lecture in October.…",2018-09-12T13:01:01Z,"{'id': None, 'name': 'Theregister.co.uk'}","Has anyone seen REM lately? No, we mean rare earth minerals",https://www.theregister.co.uk/2018/09/12/the_register_lecture_rems_from_above/,https://regmedia.co.uk/2018/09/11/the-overhead-plot-to-uncover-rare-earth-minerals.jpg?x=1200&y=794
,"According to the JRC, the global seafood consumption has more than doubled in the past 50 years, putting stress on the sustainability of fishing. Credit: AdobeStock, Alexander Raths The Joint Research Centre of the European Commission have examined the impact… [+5371 chars]",The Joint Research Centre of the European Commission have examined the impact of seafood supply chains across national boundaries—the global seafood consumption footprint.,2018-09-28T13:50:03Z,"{'id': None, 'name': 'Phys.org'}",How much fish do we consume? First global seafood consumption footprint published,https://phys.org/news/2018-09-fish-consume-global-seafood-consumption.html,https://3c1703fe8d.site.internapcdn.net/newman/gfx/news/2018/howmuchfishd.jpg
Erin,"kt814 architects have designed a new house in Jackson Hole, Wyoming, that’s been designed as a series of three connected pavilions. Sustainability, low maintenance costs, privacy, and unobstructed views, were all key factors that had to be considered when des… [+1714 chars]","Photography by David Agnello kt814 architects have designed a new house in Jackson Hole, Wyoming, that’s been designed as a series of three connected pavilions. Photography by David Agnello Sustainability, low maintenance costs, privacy, and unobstructed view…",2018-09-12T21:47:35Z,"{'id': None, 'name': 'Contemporist.com'}",This House In Wyoming Uses Dark And Light Wood To Create A Two-Toned Facade,http://www.contemporist.com/house-uses-dark-and-light-wood-to-create-a-two-toned-facade/,http://www.contemporist.com/wp-content/uploads/2018/09/modern-wood-house-architecture-120918-118-10.jpg
"feedback@businessinsider.com (Sam Jacobs), Sam Jacobs","Chinese online retailing giant Alibaba has announced that founder Jack Ma will step down as chairman, one year from today. In accordance with succession plans previously flagged by the company, current Alibaba CEO Daniel Zhang will succeed Ma as chairman on S… [+7394 chars]","Sean Gallup/Getty Images Jack Ma, the founder of online Chinese retailing giant Alibaba, will step down as Chairman on September 10, 2019. Ma will be succeeded by Daniel Zhang, Alibaba’s current CEO. Ma wrote a letter to customers and shareholders explaining …",2018-09-10T02:43:40Z,"{'id': 'business-insider', 'name': 'Business Insider'}",Jack Ma will step down as Chairman of Chinese e-commerce giant Alibaba in September 2019,https://www.businessinsider.com/alibaba-jack-ma-retiring-as-chairman-2018-9,https://amp.businessinsider.com/images/58ecf3bc8af578521f8b4ea0-1136-568.jpg
JONAH ENGEL BROMWICH,"Of course, one could also intuit that the rise of the chains cuts down on food waste, because the vegetables are coming pre-apportioned rather than piling up in bulk at home. But the container problem remains. Sweetgreens most serious competitors Chop't, Tend… [+1540 chars]","Popular fast-casual chains brag of sustainability, as customers toss their compostable and recyclable bowls into the trash with wild abandon.",2018-09-29T10:00:00Z,"{'id': 'the-new-york-times', 'name': 'The New York Times'}",Is Your Salad Habit Good for the Planet?,https://www.nytimes.com/2018/09/29/style/healthy-bowls-salad-waste.html,https://static01.nyt.com/images/2018/09/30/style/30saladbowls3/30saladbowls3-facebookJumbo.jpg
Terri Williams,"An outdoor shower can be both fun and practical. If you don’t want kids, pets and other adults tracking dirt through your house, an outdoor shower is a great way to keep the great outdoors where it belongs: outdoors. Below are some of the biggest trends in ou… [+2710 chars]","An outdoor shower can be both fun and practical. If you don’t want kids, pets and other adults tracking dirt through your house, an outdoor shower is a great way to keep the great outdoors where it belongs: outdoors. Below are some of the biggest trends in ou…",2018-08-31T21:00:00Z,"{'id': None, 'name': 'Freshome.com'}",Tips for Creating the Outdoor Shower of Your Dreams,https://freshome.com/outdoor-shower-tips/,https://cdn.freshome.com/wp-content/uploads/2018/08/Maxa-Constructions.jpg
Cynthia Bowman,"If you’re getting ready to move, you probably have an idea of the basic moving supplies you’ll need: boxes, tape and paper. However, we’ve compiled ten smart moving supplies you’ll want to add to make your move easier. These eco-friendly options will organize… [+2812 chars]","If you’re getting ready to move, you probably have an idea of the basic moving supplies you’ll need: boxes, tape and paper. However, we’ve compiled ten smart moving supplies you’ll want to add to make your move easier. These eco-friendly options will organize…",2018-09-11T12:00:47Z,"{'id': None, 'name': 'Freshome.com'}",10 Smart Moving Supplies That Will Make Moving Easier,https://freshome.com/moving-supplies/,https://cdn.freshome.com/wp-content/uploads/2018/08/bin-it.jpg
,"Climate change also has an impact on public health. Credit: Shutterstock A half-century ago, concerns about climate change, environment vulnerability, population density and the sustainability of earth systems reached a broad audience. This was clear from boo… [+5398 chars]","A half-century ago, concerns about climate change, environment vulnerability, population density and the sustainability of earth systems reached a broad audience. This was clear from books like the Silent Spring published in 1962, and The Limits to Growth pub…",2018-09-17T13:20:02Z,"{'id': None, 'name': 'Phys.org'}","Climate change, water and the spread of diseases: Connecting the dots differently",https://phys.org/news/2018-09-climate-diseases-dots-differently.html,https://3c1703fe8d.site.internapcdn.net/newman/gfx/news/2018/92-climatechang.jpg
,"GEO BON has identified six classes of 'essential biodiversity variables' to track and monitor, represented by the teal dots at the top of this figure. Guralnick and his colleagues refined the 'species traits' class by defining characteristics to measure and l… [+7640 chars]",An international team of researchers has outlined a plan for how to measure changes in key traits of animals and plants and provide these data to policymakers to improve natural resource management and keep nations on track to meet global biodiversity and sus…,2018-09-17T15:12:48Z,"{'id': None, 'name': 'Phys.org'}","Study provides roadmap for measuring animal, plant traits to meet biodiversity goals",https://phys.org/news/2018-09-roadmap-animal-traits-biodiversity-goals.html,https://3c1703fe8d.site.internapcdn.net/newman/gfx/news/hires/2018/4-studyprovide.jpg
,Credit: CC0 Public Domain More private banks are offering sustainable investment options to wealthy clients. How do these products differ from one another? And do the banks' advisory services meet the expectations of investors? A study by the University of Zu… [+5202 chars],More private banks are offering sustainable investment options to wealthy clients. How do these products differ from one another? And do the banks' advisory services meet the expectations of investors? A study by the University of Zurich into the products and…,2018-09-21T10:50:11Z,"{'id': None, 'name': 'Phys.org'}",Banks do too little to communicate their sustainable investment products,https://phys.org/news/2018-09-banks-sustainable-investment-products.html,https://3c1703fe8d.site.internapcdn.net/newman/gfx/news/hires/2017/bank.jpg
Aaron Towlson,"ga('send', 'event', 'Uncategorized', 'article', 'article-industry-impression', {nonInteraction: true}); Skyscraper design solves an obvious space issue, rising high to accommodate thousands of employees and businesses in vertical structures. The energy demand… [+1870 chars]",A new skyscraper features a folded design that blends solid aluminium panels with strategically-placed glass to reduce heat from sunlight and therefore save energy. A new skyscraper features a folded design that blends solid aluminium panels with strategicall…,2018-08-31T05:15:36Z,"{'id': None, 'name': 'Springwise.com'}",Folded facade reduces skyscraper energy bill,https://www.springwise.com/folded-facade-reduces-skyscraper-energy-bill/,https://d1udjo59ytjrp6.cloudfront.net/img/uploads/2018/08/17025407/BIG_energy_saving_facade_springwise.jpg
Victoria Moss,"E nter Amy Powney, the forceful 34 year old creative director of the small label Mother of Pearl which shows at London Fashion Week. For her, sustainability is a mindset and “way of life” which she, having grown up off-grid living in a caravan in the middle o… [+851 chars]","Increasingly, the fashion industry is toying more seriously with sustainability.",2018-09-04T14:16:48Z,"{'id': 'the-telegraph', 'name': 'The Telegraph'}",'Sustainability means nothing and everything all at once': Mother of Pearl's Amy Powney on her mission to reframe how we consume fashion,https://www.telegraph.co.uk/fashion/brands/sustainability-means-nothing-everything-mother-pearls-amy-powney/,https://www.telegraph.co.uk/content/dam/fashion/2018/09/04/TELEMMGLPICT000172390873-xlarge_trans_NvBQzQNjv4Bqtt-PMhmmlxqdgRPvuJG6C1jSXUMD6a1qhWMgiZzdDhI.jpeg
"Steve Banker, Contributor, Steve Banker, Contributor https://www.forbes.com/sites/stevebanker/",Share to facebook Share to twitter Share to linkedin Corporate Knight Produces a Report on the World's Most Sustainable Companies Corporate Knight Every year Corporate Knights puts out a report ranking the world's most sustainable companies. This year Dassaul… [+9790 chars],"Dassault Systemes is the world's most sustainable company. Amazon has the least. Amazon is working to improve, but not in transportation. And it is the delivery of all those packages where their supply chain creates the greatest adverse impacts on the environ…",2018-09-20T16:41:00Z,"{'id': None, 'name': 'Forbes.com'}",The Best And Worst In Sustainability: Dassault Systèmes Versus Amazon,https://www.forbes.com/sites/stevebanker/2018/09/20/the-best-and-worst-in-sustainability-dassault-systemes-versus-amazon/,https://thumbor.forbes.com/thumbor/600x315/https%3A%2F%2Fblogs-images.forbes.com%2Fstevebanker%2Ffiles%2F2018%2F09%2FCorporateKnight-e1537460623920.jpg
