author,content,description,publishedAt,source,title,url,urlToImage
Saqib Shah,"A total of 50 episodes have been commissioned this time round, up from the first season's 11-episode run, with Semtex kicking things off with an interview with UK rapper Ghetts. The ex-BBC Radio 1Xtra DJ's arrival on Spotify marks the platform's latest hip-ho… [+832 chars]","Following in the footsteps of Zane Lowe and Ryan Newman, hip-hop aficionado DJ Semtex is the latest BBC Radio veteran to jump ship to a music streaming service. He'll be handling co-presenting duties alongside RCA's Parris O'Loughlin-Hoste on season two of Sp…",2018-09-21T12:20:00Z,"{'id': 'engadget', 'name': 'Engadget'}",Spotify taps DJ Semtex for hip-hop culture podcast,https://www.engadget.com/2018/09/21/spotify-dj-semtex-who-we-be-talks-podcast/,https://o.aolcdn.com/images/dims?thumbnail=1200%2C630&quality=80&image_uri=https%3A%2F%2Fs.aolcdn.com%2Fhss%2Fstorage%2Fmidas%2Fac8cdfcce97aa652d9756caad3e2906c%2F206682699%2Fp04hy25f.jpg&client=amp-blogside-v2&signature=0a556075777ae35701aff22057246b312c39b04f
Romain Dillet,"A few days ago, I interviewed Ken Kocienda at TechCrunch Disrupt SF — he just released a book called Creative Selection. After working at Apple during some of the company’s best years, Kocienda looks back at what makes Apple such a special place. The book in … [+893 chars]","A few days ago, I interviewed Ken Kocienda at TechCrunch Disrupt SF — he just released a book called Creative Selection. After working at Apple during some of the company’s best years, Kocienda looks back at what makes Apple such a special place. The book in …",2018-09-10T15:14:15Z,"{'id': 'techcrunch', 'name': 'TechCrunch'}",What makes Apple’s design culture so special,http://techcrunch.com/2018/09/10/what-makes-apples-design-culture-so-special/,https://techcrunch.com/wp-content/uploads/2018/09/disrupt-Ken-Kocienda.jpg?w=600
Martha Tesema,"Bottle flipping, America's favorite pastime, will never die. It's a skill that few possess, and produces an unmatched thrill when you finally land your first bottle. Take this grandma, for example, who stacked three cans of beans and then defied all odds by f… [+58 chars]","Bottle flipping, America's favorite pastime, will never die. It's a skill that few possess, and produces an unmatched thrill when you finally land your first bottle. Take this grandma, for example, who stacked three cans of beans and then defied all odds by f…",2018-09-14T15:03:13Z,"{'id': 'mashable', 'name': 'Mashable'}",Please enjoy this grandmother's perfect bottle flip,https://mashable.com/video/grandma-bottle-flip-video/,https://i.amz.mshcdn.com/2M3R0w2z1Q08iWCFP1oNejWW318=/1200x630/2018%2F09%2F14%2F6b%2F0baf30b27a0b4322891e28cf1c713b73.94562.jpg
JOHN KOBLIN,"“I felt like I was doing the best work of my life on some of these shows,” she said. “It was so frustrating.” Last year, Peter Roth, the president of the Warner Bros. television unit, asked Ms. English to consider writing a “Murphy Brown” script after the spe… [+1067 chars]","The revival of the acclaimed comedy, which debuts on CBS on Sept. 27, has reunited the original cast after two decades and plans to take on the Trump administration.",2018-09-19T17:04:39Z,"{'id': 'the-new-york-times', 'name': 'The New York Times'}",‘Murphy Brown’ Returns to Fight New Culture Wars,https://www.nytimes.com/2018/09/19/arts/television/murphy-brown-candice-bergen.html,https://static01.nyt.com/images/2018/09/23/arts/23murphybrown1/23murphybrown1-facebookJumbo.jpg
Rhett Jones,"“We’re a culture of builders,” Janelle Gale, Facebook’s VP of Human Resouces, says in a new video promoting the company’s lavish new office in Menlo Park, California. Gale believes that the recently completed piece of architecture accurately reflects the kind… [+3596 chars]","“We’re a culture of builders,” Janelle Gale, Facebook’s VP of Human Resouces, says in a new video promoting the company’s lavish new office in Menlo Park, California. Gale believes that the recently completed piece of architecture accurately reflects the kind…",2018-09-04T23:50:00Z,"{'id': None, 'name': 'Gizmodo.com'}",Facebook's New Office Looks Like a Tree House Built By an Incompetent Dad,https://gizmodo.com/facebooks-new-office-looks-like-a-tree-house-built-by-a-1828808915,"https://i.kinja-img.com/gawker-media/image/upload/s--eKhiHUv8--/c_fill,fl_progressive,g_center,h_900,q_80,w_1600/fsptjold3hh4lyivygne.png"
Brian Geddes,"September 7, 2018 5 min read Opinions expressed by Green Entrepreneur contributors are their own. As often happens in fledgling, innovative industries, a fear has gripped the cannabis industry, especially amongst the early players (the “OG’s,” if you will). T… [+5409 chars]",For generations marijuana was a cheerfully outlaw industry and a passionate cause. The accomplishments of those pioneers deserve respect from the people rushing in now hoping to get rich.,2018-09-07T12:00:00Z,"{'id': None, 'name': 'Greenentrepreneur.com'}",Cannabis Culture Is Fast Becoming Corporate Culture,https://www.greenentrepreneur.com/article/319598,https://assets.entrepreneur.com/content/3x2/2000/20180906194428-GettyImages-537506999-edit.jpeg
Xavier Piedra,"I don't mean to alarm anyone, but it's totally possible that at some point, Mount St. Helens could erupt again. However, not to worry — when it does, it's going to be a ""fine swell day,"" at least according to this ridiculous YouTube song by instrumentalist Bi… [+333 chars]","I don't mean to alarm anyone, but it's totally possible that at some point, Mount St. Helens could erupt again. However, not to worry — when it does, it's going to be a ""fine swell day,"" at least according to this ridiculous YouTube song by instrumentalist Bi…",2018-09-19T15:25:05Z,"{'id': 'mashable', 'name': 'Mashable'}",This weirdly peppy anthem for end times will be stuck in your head for days,https://mashable.com/video/bill-wurtz-mount-st-helen-song-youtube/,https://i.amz.mshcdn.com/1a44EASiuhIu8huDbfDbw65r2vg=/1200x630/2018%2F09%2F19%2Fbf%2Fcf9b07e1e12345cdb8155c813eebd7bb.a241d.png
Jake Krol,"TLDR: These student ID photos are next level. Chances are you probably haven't heard of North Farmington High School in Farmington Hills, Michigan. That changes now. The school's entire senior class took school ID cards to the next level, dressing themselves … [+979 chars]","TLDR: These student ID photos are next level. Chances are you probably haven't heard of North Farmington High School in Farmington Hills, Michigan. That changes now. The school's entire senior class took school ID cards to the next level, dressing themselves …",2018-09-16T17:45:49Z,"{'id': 'mashable', 'name': 'Mashable'}",These high school seniors took ID photos to the next level,https://mashable.com/article/meme-culture-student-id-north-farmington-high-school-/,https://i.amz.mshcdn.com/4rGDcA9EECWAy0VMY4NQ9oFQzBg=/1200x630/2018%2F09%2F16%2Fb5%2Ffb9f6b7600bd4f7d9accaac2a829724d.0faff.png
ANEMONA HARTOCOLLIS and DANA GOLDSTEIN,"At St. Pauls, an Episcopal boarding school in New Hampshire, all students now take part in bystander training, in which they role-play how to intervene in various scenarios, such as sexual aggression, bullying on social media or hazing on a sports team. The m… [+2042 chars]","The allegations against Judge Brett Kavanaugh have reminded millions of Americans of the hard-drinking, hypersexualized “bro culture,” often associated with fraternities and prep schools.",2018-09-28T21:23:42Z,"{'id': 'the-new-york-times', 'name': 'The New York Times'}",Schools Are Tackling ‘Bro’ Culture. The Kavanaugh Case Shows Why That’s Hard to Do.,https://www.nytimes.com/2018/09/28/us/kavanaugh-fraternities-prep-school.html,https://static01.nyt.com/images/2018/09/27/us/00kavanaughschools-01/00kavanaughschools-01-facebookJumbo.jpg
BRIAN TALLERICO,"For the past three decades, there has been one constant in Americas comedy landscape: The Simpsons. With that animated sitcom now approaching the start of its 30th season, on Sept. 30, its a good time to reflect on how The Simpsons has evolved during its unpa… [+1040 chars]","Homer, Marge, Bart, Lisa and Maggie: Since 1989, they haven’t aged a day. But they have evolved, as the culture has with them.",2018-09-29T18:43:47Z,"{'id': 'the-new-york-times', 'name': 'The New York Times'}",‘The Simpsons’ at 30: Six Era-Defining Episodes,https://www.nytimes.com/2018/09/28/arts/television/simpsons-history-season-30-timeline.html,https://static01.nyt.com/images/2018/09/28/arts/28simpsons/28simpsons-facebookJumbo.jpg
https://www.facebook.com/bbcnews,"Image caption The legacy of US President Andrew Jackson is often cited as having changed the face of US politics From the War of Independence through to the election of Donald Trump and on into the much anticipated mid-term elections, one group has been to th… [+5734 chars]",The significance of one culture on the creation of the American political system.,2018-09-16T05:44:45Z,"{'id': 'bbc-news', 'name': 'BBC News'}",The 'Scotch-Irish' influence on US democracy,https://www.bbc.co.uk/news/uk-northern-ireland-45487891,https://ichef.bbci.co.uk/news/1024/branded_news/8A71/production/_103414453_jackson2.jpg
"Stephen Johnson on Offspring, shared by Stephen Johnson to Lifehacker","Most old kids TV shows are like bottles of champagne gone flat. Once the fizz of the pop culture moment passes, theyre just vinegar you pour down the drain. But not always. Some shows transcend their moment, by chance or by design, and manage to become timele… [+7058 chars]","Most old kids TV shows are like bottles of champagne gone flat. Once the fizz of the pop culture moment passes, they’re just vinegar you pour down the drain. But not always. Some shows transcend their moment, by chance or by design, and manage to become timel…",2018-09-27T15:00:00Z,"{'id': None, 'name': 'Lifehacker.com'}",Watch These Timeless TV Shows With Your Kids,https://offspring.lifehacker.com/watch-these-timeless-tv-shows-with-your-kids-1829337673,"https://i.kinja-img.com/gawker-media/image/upload/s--2fRucSVL--/c_fill,fl_progressive,g_center,h_900,q_80,w_1600/gi6f1enkhqgtcjvp5uba.jpg"
"Michelle Woo on Offspring, shared by Michelle Woo to Lifehacker","This week, weve read story after wrenching story of sexual assault. Weve heard the old excuse boys will be boys. Weve seen inexcusable behavior brushed off as normal teen hijinks. One thing has become clear: whatever were doing to teach our kids about consent… [+4689 chars]","This week, we’ve read story after wrenching story of sexual assault. We’ve heard the old excuse “boys will be boys.” We’ve seen inexcusable behavior brushed off as normal teen hijinks. One thing has become clear: whatever we’re doing to teach our kids about c…",2018-09-28T20:00:00Z,"{'id': None, 'name': 'Lifehacker.com'}",A Parent's Guide to Teaching Your Kid About Consent,https://offspring.lifehacker.com/a-parents-guide-to-teaching-your-kid-about-consent-1829399859,"https://i.kinja-img.com/gawker-media/image/upload/s--tIJVb5XR--/c_fill,fl_progressive,g_center,h_900,q_80,w_1600/m8ougfskz2zpb0pmdpqv.jpg"
GINIA BELLAFANTE,"Polo announced last year that it was leaving Fifth Avenue. Madison Avenue now famously has its empty storefronts. When I returned to the website for One57 this week, I noticed that it now mentions Arche, the entirely unglamorous maker of flexible shoes, which… [+2009 chars]",New York’s transformation as a playground for the rich has paradoxically left it with a retail culture that offers less luxury to experience.,2018-09-24T22:17:39Z,"{'id': 'the-new-york-times', 'name': 'The New York Times'}",Big City: Henri Bendel and the Death of Luxury,https://www.nytimes.com/2018/09/24/nyregion/henri-bendel-and-the-death-of-luxury.html,https://static01.nyt.com/images/2018/09/23/nyregion/23big/23big-facebookJumbo.jpg
DAVID BELCHER,"HONG KONG — I never thought I’d be so excited to see “Cats.” After soaking up Western culture — primarily in New York, London and Paris — about thrice a week for more than 20 years, I accepted a job two years ago in the Hong Kong office of The Times. No sweat… [+1113 chars]",The enchanting and futuristic opera houses of the country’s megacities don’t offer Italian masterpieces every night. A deprived culture vulture must do what’s necessary.,2018-09-10T19:00:06Z,"{'id': 'the-new-york-times', 'name': 'The New York Times'}",Why I’m Willing to Suffer Through ‘Cats’ in China,https://www.nytimes.com/2018/09/10/opinion/david-belcher-china-opera-theater.html,https://static01.nyt.com/images/2018/09/06/opinion/00belcher1/00belcher1-facebookJumbo.jpg
MICHAEL PAULSON and INYOUNG KANG,"Years after Guadalupe Rosales left Los Angeles, she found herself looking back at the fliers, the lip liner, the party crews the materials that told the story of the culture and the home shed left behind. She began @ veteranas_and_rucas, an Instagram feed ded… [+852 chars]","Friday: Sarah Jones’s “Sell/Buy/Date” comes to L.A., the Kavanaugh hearing, Elon Musk is sued by the S.E.C., and cataloging Latina youth culture.",2018-09-28T12:55:12Z,"{'id': 'the-new-york-times', 'name': 'The New York Times'}","California Today: California Today: A Show About ‘Women, Sex and Power’ Gains New Urgency",https://www.nytimes.com/2018/09/28/us/california-today-sarah-jones-sell-buy-date.html,https://static01.nyt.com/images/2018/09/28/us/28californiatoday/28californiatoday-facebookJumbo.jpg
"STEPHANIE SAUL, ROBIN POGREBIN, MIKE McINTIRE and BEN PROTESS","DKE was a huge party fraternity, said a former classmate, Sarah Dry. Lots of drunken parties. The DKE pledge process was widely seen on campus as degrading. An opinion piece in The Yale Daily News in 1986 said that pledges were forced to walk around campus re… [+1524 chars]","Deborah Ramirez and Judge Brett Kavanaugh came to Yale from very different backgrounds. But their college circles overlapped, and during a drinking game at a dorm party, she claims, he exposed himself to her.",2018-09-26T00:46:49Z,"{'id': 'the-new-york-times', 'name': 'The New York Times'}","In Yale’s Culture of Privilege and Alcohol, Her World Converged With Kavanaugh’s",https://www.nytimes.com/2018/09/25/us/politics/deborah-ramirez-brett-kavanaugh-allegations.html,https://static01.nyt.com/images/2018/09/26/us/26YEARBOOKMUGS-diptych/26YEARBOOKMUGS-diptych-facebookJumbo.jpg
Catherine Shu,"In an important move for inclusion in the gaming community, the Xbox Adaptive Controller, created for gamers with mobility issues, is now on sale. The Victoria and Albert Museum (V&amp;A) also announced today that it has acquired the Xbox Adaptive Controller … [+2751 chars]","In an important move for inclusion in the gaming community, the Xbox Adaptive Controller, created for gamers with mobility issues, is now on sale. The Victoria and Albert Museum (V&A) also announced today that it has acquired the Xbox Adaptive Controller for …",2018-09-05T03:14:22Z,"{'id': 'techcrunch', 'name': 'TechCrunch'}",The Xbox Adaptive Controller goes on sale today and is also now part of the V&A museum’s collection,http://techcrunch.com/2018/09/04/the-xbox-adaptive-controller-goes-on-sale-today-and-is-also-now-part-of-the-va-museums-collection/,https://techcrunch.com/wp-content/uploads/2018/09/Xbox-Adaptive-Controller.jpg?w=711
Adam Rosenberg,"""This is ridiculous and from the Twilight Zone."" When Brett Kavanaugh pushed back against his third accuser, Julie Swetnick, in a Wednesday statement, the Twilight Zone quote is the one that made the rounds. Now, the daughter of series creator Rod Serling has… [+1152 chars]","""This is ridiculous and from the Twilight Zone."" When Brett Kavanaugh pushed back against his third accuser, Julie Swetnick, in a Wednesday statement, the Twilight Zone quote is the one that made the rounds. Now, the daughter of series creator Rod Serling has…",2018-09-29T21:26:26Z,"{'id': 'mashable', 'name': 'Mashable'}",Brett Kavanaugh draws a sharp rebuke from 'The Twilight Zone' family,https://mashable.com/article/twilight-zone-brett-kavanaugh-anne-serling-tweet/,https://i.amz.mshcdn.com/aBqddGexlp1zNqZYd-1dqRVRc3A=/1200x630/2018%2F09%2F29%2F14%2F11202ae371534d1fa3da30cd49b66294.8321f.jpg
Nicole Gallucci,"Sometimes a week is so upsetting you just have to find joy in the unexpected. Take this huge-ass pumpkin, for example. Steve Geddes of Boscawen, New Hampshire just made U.S. history by growing a pumpkin so large it surpassed the record for largest pumpkin in … [+1810 chars]","Sometimes a week is so upsetting you just have to find joy in the unexpected. Take this huge-ass pumpkin, for example. Steve Geddes of Boscawen, New Hampshire just made U.S. history by growing a pumpkin so large it surpassed the record for largest pumpkin in …",2018-09-29T15:43:39Z,"{'id': 'mashable', 'name': 'Mashable'}",Here's the biggest pumpkin in U.S. history because we all need something nice,https://mashable.com/article/biggest-pumpkin-north-american-history/,https://i.amz.mshcdn.com/ejbrsXKAyac6GSUJIyoSy8uhQvM=/1200x630/2018%2F09%2F29%2Fc6%2F3c90835a31c94d91a7e4414b2be59138.9bf29.jpg
Johnny Lieu,"Two Australian ambulance officers have been praised for a kind, yet simple act for a dying man. As per a Facebook post by the Queensland Ambulance Service, 72-year-old Ron McCartney took a trip to hospital for palliative care last week. SEE ALSO: This viral T… [+1547 chars]","Two Australian ambulance officers have been praised for a kind, yet simple act for a dying man. As per a Facebook post by the Queensland Ambulance Service, 72-year-old Ron McCartney took a trip to hospital for palliative care last week. SEE ALSO: This viral T…",2018-09-06T07:31:35Z,"{'id': 'mashable', 'name': 'Mashable'}",Ambulance officers lauded for granting dying man's wish for a sundae,https://mashable.com/article/ambulance-officer-sundae-act/,https://i.amz.mshcdn.com/g0ngy8L7FUgWtwNWalPyQUsCqxk=/1200x630/2018%2F09%2F06%2F1e%2F127eac265165402885569828f5fdb23d.82873.jpg
Chloe Bryan,"This post is part of Hard Refresh, a soothing weekly column where we try to cleanse your brain of whatever terrible thing you just witnessed on Twitter. When I'm seeking feelings of peace and tranquility, the internet is not the first place I look. But if I a… [+2347 chars]","This post is part of Hard Refresh, a soothing weekly column where we try to cleanse your brain of whatever terrible thing you just witnessed on Twitter. When I'm seeking feelings of peace and tranquility, the internet is not the first place I look. But if I a…",2018-09-05T17:00:00Z,"{'id': 'mashable', 'name': 'Mashable'}",The interactive rain website that brings me temporary peace online,https://mashable.com/article/hard-refresh-looking-at-something-rain-website/,https://i.amz.mshcdn.com/W1z5EFjnF3JXv6YxIYi_FVbNkiA=/1200x630/2018%2F08%2F31%2F39%2Fe5e8102e48c249fdb4a78d7b95da4554.58f82.png
Morgan Sung,"Apparently Tinder is just too basic for some people. Carlos Zetina only knew a handful of things about the girl he met at a campus bar: her name was Nicole, she was from Holland, she attended the University of Calgary, and she thought Nietzche was depressing.… [+2349 chars]","Apparently Tinder is just too basic for some people. Carlos Zetina only knew a handful of things about the girl he met at a campus bar: her name was Nicole, she was from Holland, she attended the University of Calgary, and she thought Nietzche was depressing.…",2018-09-10T23:00:26Z,"{'id': 'mashable', 'name': 'Mashable'}","Guy emails 246 Nicoles in search of a girl he met at a bar, and now they're all friends",https://mashable.com/article/man-emails-246-nicoles-for-date/,https://i.amz.mshcdn.com/RPv8TX2WzuuhpGwA3sC7HR-KGEI=/1200x630/2018%2F09%2F10%2F3e%2F3c28e825266141cdaffc929328aa4610.7ed20.png
Amanda Luz Henning Santiago,"The first day at a new job is bound to have its learning curves, but most don't include almost being smushed between two cars. Twitter user @0ctobersVeryOwn shared a startling video of a first day working at a car wash gone awry, and I think you can already s… [+494 chars]","The first day at a new job is bound to have its learning curves, but most don't include almost being smushed between two cars. Twitter user @0ctobersVeryOwn shared a startling video of a first day working at a car wash gone awry, and I think you can already s…",2018-09-17T14:14:10Z,"{'id': 'mashable', 'name': 'Mashable'}",Watch this car wash employee expertly escape getting caught between two vehicles,https://mashable.com/article/car-wash-employee-stuck-between-cars/,https://i.amz.mshcdn.com/0Q6FzLyajTRLAYIRwv3ZDq1_jO8=/1200x630/2018%2F09%2F17%2F54%2F689f7ae6ec2f4015a03e05009679bfb8.eb575.png
Martha Tesema,"You could fill the Library of Congress with books about Beyoncé moments and there still wouldn't be enough room. OK, clearly that was a stretch. But the Queen has been such a staple in culture, that content is created from her doing everything from the *most*… [+962 chars]","You could fill the Library of Congress with books about Beyoncé moments and there still wouldn't be enough room. OK, clearly that was a stretch. But the Queen has been such a staple in culture, that content is created from her doing everything from the *most*…",2018-09-14T21:03:36Z,"{'id': 'mashable', 'name': 'Mashable'}",Beyoncé's most meme-able moments,https://mashable.com/article/best-beyonce-memes/,https://i.amz.mshcdn.com/EBd4Qrr63qQgj6y5F3DiVpoGJR8=/1200x630/2018%2F09%2F14%2Ff1%2F4328b56ed80443668666dbd91f01e184.44e5b.jpg
NANCY HASS,"Though modern house paint is usually a benign mix of synthetic pigment, acrylic, water and fillers like clay or zinc oxide, in earlier eras, creating paint was a dangerous business. While some colors came from harmless organic sources — curdled milk, charcoal… [+2622 chars]","In an East London studio, Pedro da Costa Felgueiras spends his time stirring up ancient hues that are now too costly (or dangerous) to make.",2018-09-06T20:02:08Z,"{'id': 'the-new-york-times', 'name': 'The New York Times'}",Notes on the Culture: How One Man Is Recreating Lost Colors,https://www.nytimes.com/2018/09/05/t-magazine/pedro-da-costa-felgueiras-recreating-lost-colors.html,https://static01.nyt.com/images/2018/09/04/t-magazine/04tmag-paint-slide-L5IN/04tmag-paint-slide-L5IN-facebookJumbo.jpg
Laura Byager,"A tiger cannot change its stripes, but others can copy them and wear them as their own. Professional golfer Tiger Woods apparently has a true doppelgänger walking this earth and the resemblance is... just wow. SEE ALSO: Someone is trying to stop Johny Johny Y… [+436 chars]","A tiger cannot change its stripes, but others can copy them and wear them as their own. Professional golfer Tiger Woods apparently has a true doppelgänger walking this earth and the resemblance is... just wow. SEE ALSO: Someone is trying to stop Johny Johny Y…",2018-09-04T09:49:42Z,"{'id': 'mashable', 'name': 'Mashable'}",This Tiger Woods doppelgänger totally upstaged the real Tiger at a golf tournament,https://mashable.com/article/tiger-woods-doppelganger-golf/,https://i.amz.mshcdn.com/1Lo_UK1igQRnPuyL_YerrMhq59k=/1200x630/2018%2F09%2F04%2Ff1%2Fddc3894fa69441c6bd6eab2a05d956a4.ee201.jpg
Morgan Sung,"These nuns are fighting guns with guns. Sort of. The Northwest Coalition for Responsible Investment, a collective of about a dozen nun associations, invests in companies so they can then use their shareholder status to sway the companies into supporting human… [+1825 chars]","These nuns are fighting guns with guns. Sort of. The Northwest Coalition for Responsible Investment, a collective of about a dozen nun associations, invests in companies so they can then use their shareholder status to sway the companies into supporting human…",2018-09-07T21:53:19Z,"{'id': 'mashable', 'name': 'Mashable'}",These nuns buy stock in gun companies to fight for gun safety,https://mashable.com/article/nuns-buy-stock-gun-control/,https://i.amz.mshcdn.com/LTjom7gVSwA9QnpvXSQGIACKmyE=/1200x630/2018%2F09%2F07%2F9e%2F3bf00de023394527974cfefa05653096.4af64.jpg
Morgan Sung,"Special Counsel Robert Mueller, who has been spearheading the investigation into foreign interference in the 2016 presidential election in an effort to uphold our nation's democracy, needs tech support. SEE ALSO: And now we pick up the pieces after our meltdo… [+1399 chars]","Special Counsel Robert Mueller, who has been spearheading the investigation into foreign interference in the 2016 presidential election in an effort to uphold our nation's democracy, needs tech support. SEE ALSO: And now we pick up the pieces after our meltdo…",2018-09-26T22:47:47Z,"{'id': 'mashable', 'name': 'Mashable'}",Robert Mueller spotted at the Apple Store getting tech support,https://mashable.com/article/robert-mueller-apple-store/,https://i.amz.mshcdn.com/_9PJjCYY1AgkXd4o0gkxgLmq1t4=/1200x630/2018%2F09%2F26%2Fa7%2F9fd145ee694949f79a59b040c695af73.3fd77.png
Morgan Sung,"Chrissy Teigen, once again, is a whole mood. Colin Jost and Michael Che's painfully unfunny opening monologue drew scattered applause and awkward laughs. SEE ALSO: Michael Che and Colin Jost try to tackle diversity in sloppy Emmys monologue In response to a p… [+525 chars]","Chrissy Teigen, once again, is a whole mood. Colin Jost and Michael Che's painfully unfunny opening monologue drew scattered applause and awkward laughs. SEE ALSO: Michael Che and Colin Jost try to tackle diversity in sloppy Emmys monologue In response to a p…",2018-09-18T00:57:40Z,"{'id': 'mashable', 'name': 'Mashable'}",Chrissy Teigen graces the internet with another awards show meme,https://mashable.com/article/chrissy-teigen-meme-emmys-reaction/,https://i.amz.mshcdn.com/Jl-xXREoqiEukuguPGdZqKl4eX8=/1200x630/2018%2F09%2F18%2Fb8%2F2560698ddf4d43f19583cf5cf2995c32.b58cd.jpg
